QUEST_JOBSTEP_20150317_000001	邪靈祭司！你選擇了困難的路。{nl}參考冒險日誌的製作法，製造獨特的人偶吧！	보코르라. 어려운 길을 택하셨군요.{nl}모험일지의 제작법을 참고하여 당신만의 인형을 만들어 오세요.				보코르 마스터
QUEST_JOBSTEP_20150317_000002	如果自己不去求就無法獲得。{nl}人偶的製造法請參考你的冒險日誌。	스스로 구하지 않으면 얻을 수 없습니다.{nl}인형의 제조법은 당신의 모험일지를 참고하세요.				보코르 마스터
QUEST_JOBSTEP_20150317_000003	恭喜，新的邪靈祭司誕生了。{nl}過去我選擇邪靈祭司的路時，也是先從製造自己的人偶開始。{nl}	새로운 보코르의 탄생을 축하합니다.{nl}제가 보코르의 길을 선택했을 땐 나만의 인형을 만드는 것부터 시작했답니다.{nl}				
QUEST_JOBSTEP_20150317_000004	輕裝步兵大師	펠타스타 마스터				
QUEST_JOBSTEP_20150317_000005	你如果真的要接受我的教導，必須要證明你是否有資格。{nl}給你一項任務。請消滅佔領水晶礦山1層的布貝們。{nl}{nl}	그대가 정녕 제게 가르침을 받고 싶다면 그 자격이 있는지 증명해야 할 것입니다.{nl}과제를 드리지요. 수정광산 1층을 점령하고 있는 부베들을 처치하십시오.{nl}{nl}				
QUEST_JOBSTEP_20150317_000006	這點程度都做不到，怎麼肩負輕裝步兵之名呢？	그 정도도 해내지 못하고서야 어찌 펠타스타의 이름을 짊어진단 말입니까?				펠타스타 마스터
QUEST_JOBSTEP_20150317_000007	很好。{nl}希望你的成長能夠守護世界。	좋습니다.{nl}그대의 성장이 세상을 지키는 일이 되길 바라겠습니다.				펠타스타 마스터
QUEST_JOBSTEP_20150317_000008	高地戰士大師	하이랜더 마스터				
QUEST_JOBSTEP_20150317_000009	我真的很感謝你願意繼承我的劍法，但我懷疑你是否能順利跟上。{nl}我想讓你去對付占領水晶礦山1層的布貝藉此考驗你。	그대가 나의 검법을 계승하겠다는 건 참으로 고마운 일이나 제대로 따라올 수 있을지 의문이 드는군.{nl}수정광산 1층을 점거하고 있는 부베들을 처치하는 것으로 그대를 시험해 보겠다.				
QUEST_JOBSTEP_20150317_000010	動作快。{nl}雖然是入門任務，但那些布貝對礦山村莊造成威脅是事實。	서둘러라.{nl}비록 입문 과제이지만 그 부베들이 광산 마을의 위협이 되는 건 사실이니까.				하이랜더 마스터
QUEST_JOBSTEP_20150317_000011	結果很好。我允許你加入高地戰士。{nl}今後也要努力修練。	결과가 좋군. 그대의 하이랜더 입문을 허락하겠다.{nl}앞으로도 열심히 정진하도록.				하이랜더 마스터
QUEST_JOBSTEP_20150317_000012	烈焰法師大師	파이로맨서 마스터				
QUEST_JOBSTEP_20150317_000013	你想要跟我學習魔法的那份熱情我懂，但是我是不會隨便教人的。{nl}我要視你能輔助我的研究到什麼程度來決定。	저에게 마법을 배우겠다는 열의는 알겠습니다만, 아무에게나 가르쳐 드릴 순 없습니다.{nl}제 연구를 얼마나 잘 보조해 주시는지에 따라서 결정하겠어요.				
QUEST_JOBSTEP_20150317_000014	辛苦了。託你的福我能進入下一個研究階段了。{nl}我會依約定教你烈焰法師的魔法。	수고하셨어요. 덕분에 다음 연구단계로 넘어갈 수 있겠네요.{nl}약속대로 파이로맨서의 마법을 가르쳐 드리지요.				
QUEST_JOBSTEP_20150317_000015	你來得正好。你該為我做的就是消滅我召喚出來的惡靈。{nl}我會記錄過程中釋出的特殊波長。	잘 오셨어요. 당신이 해 주실 일은 제가 소환한 악령을 처치해 주시면 됩니다.{nl}그 과정에서 뿜어져 나오는 특별한 파장을 기록하겠어요.				
QUEST_JOBSTEP_20150317_000016	我正在研究物質的第4種狀態。{nl}如果沒有能控制靈魂的邪靈祭司大師的協助，我是絕對辦不到的。	전 물질의 제4번째 상태에 대해 연구중입니다.{nl}영혼을 다루는 보코르 마스터님의 협조가 없으면 절대로 불가능한 일이지요.				
QUEST_JOBSTEP_20150317_000017	很好，非常厲害。{nl}請告訴烈焰法師大師你已經收集到所有需要的資料了。	네. 아주 훌륭하군요.{nl}파이로맨서 마스터께 필요한 자료는 전부 모였다고 전해 드리세요.				보코르 마스터
QUEST_JOBSTEP_20150317_000018	很好。{nl}我正在和邪靈祭司大師一起進行那項研究，請你過去找他，他會把該做的事告訴你。	좋습니다. {nl}그 연구는 보코르 마스터님과 함께 진행중이니 그분께 가면 할 일을 일러주실 겁니다.				
QUEST_JOBSTEP_20150317_000019	寒冰法師大師	크리오맨서 마스터				
QUEST_JOBSTEP_20150317_000020	想跟我學魔法嗎？{nl}我當然會教你。但你必須幫我處理一件事。	제게 크리오맨서의 마법을 배우고 싶으시다고요.{nl}물론 가르쳐 드리지요. 한 가지 일만 잘 처리해 주신다면요.				
QUEST_JOBSTEP_20150317_000021	烈焰法師大師目前不在。{nl}唉，這件事非常簡單。	파이로맨서 마스터는 현재 부재중이십니다.{nl}뭐, 아주 쉬운 일입니다.				크리오맨서 마스터
QUEST_JOBSTEP_20150317_000022	請別內疚。您做得非常好。{nl}從現在起我會助您一臂之力，您不必太過擔心。	죄책감 따윈 신경 쓰지 마세요. 아주 잘해주셨습니다.{nl}이제부턴 제가 당신의 뒤를 봐 드릴 테니 너무 걱정하지 않으셔도 됩니다.				크리오맨서 마스터
QUEST_JOBSTEP_20150317_000023	請偷偷潛入烈焰法師的房中，把裝在房中箱子裡的東西帶來給我。{nl}此外的東西請你自己看著辦。	파이로맨서의 방에 몰래 잠입해 그곳에 있는 상자를 여는 것입니다.{nl}그 안에 있는 것은.. 죽여버리는 게 좋겠네요.				
QUEST_JOBSTEP_20150317_000024	這種程度的話，已足夠了。{nl}我的魔法會比你想像中的難，所以你要努力跟著我學習喔。	이 정도면 충분하군.{nl}내 마법은 어려우니까 열심히 따라와야 할 거야.				
QUEST_JOBSTEP_20150317_000025	想向我學習的決心是很好，但必須替我做一件事。{nl}必須接受才能繼續談下去。{nl}	내게 뭘 배우겠다는 마음가짐은 좋다만 대신 한 가지 부탁이 있네.{nl}들어주겠다고 해야만 이야기를 계속할 수 있어.{nl}				쿼렐슈터 마스터
QUEST_JOBSTEP_20150317_000026	竟然是利迪亞夏班的物品，那對我們弓箭手來說就像聖物一樣。{nl}如果可以，就算賣掉所有的財產也想要擁有它。	리디아 샤펜의 물건이라니, 우리 궁수들에겐 성물 같은 존재라고.{nl}할 수만 있다면 전 재산을 팔아서라도 갖고 싶군.				쿼렐슈터 마스터
QUEST_JOBSTEP_20150317_000027	沒想到我能親眼看到它。{nl}謝謝你。現在起我會徹底指導你，你要做好覺悟。	이걸 직접 내 눈으로 보게 될 줄이야.{nl}고맙네. 이제부턴 철저히 지도해 줄 테니 각오 하는 게 좋을 거야.				쿼렐슈터 마스터
QUEST_JOBSTEP_20150317_000028	聽說從星之塔中消失的望遠鏡的鏡片就在水晶礦山1層。{nl}如果你能在其他大師發現之前盡快把它帶來給我，我就把我的技術教給你。	별의 탑에서 사라진 망원경의 렌즈가 수정광산 1층에 있다더군.{nl}다른 마스터들이 눈치채기 전에 빨리 그 렌즈를 가져다주면 내 기술을 가르쳐 주겠네.				쿼렐슈터 마스터
QUEST_JOBSTEP_20150317_000029	你想跟我學弓.. 那麼我委託你一件事。{nl}我要看你能把那件事做得多好再決定要不要教你。	나에게 활을 배우고 싶다라.. 그렇다면 당신에게 한 가지 의뢰를 하지. {nl}그 일을 얼마나 잘 해내느냐에 따라서 당신을 가르칠지 결정하겠어.				
QUEST_JOBSTEP_20150317_000030	艾保尼風… 無法原諒。	에보니폰.. 용서할 수 없어.				레인저 마스터
QUEST_JOBSTEP_20150317_000031	獵人大師	헌터 마스터				
QUEST_JOBSTEP_20150317_000032	書全都集齊啦。辛苦了。{nl}我會依照約定允許你成為獵人。	책이 전부 모였군요. 수고하셨어요.{nl}약속한 대로 당신에게 헌터의 기술을 가르쳐 드리겠어요.				
QUEST_JOBSTEP_20150317_000033	成果很明確。那我從現在開始教你吧！{nl}希望你別辜負我的期待。	성과는 확실하군. 이제부터 내가 널 가르치지.{nl}내 기대에 확실히 부응해 주길 기대하겠어.				
QUEST_JOBSTEP_20150317_000034	我聽傳聞說水晶礦山1層的蝙蝠含有特別的毒。{nl}那一定是暗殺者艾保尼風所用的毒。請把毒提取回來。	수정광산 1층의 박쥐들은 특별한 독을 품고 있다는 소문을 들었어.{nl}분명히 암살자 에보니폰이 쓰는 독일 거야. 그 독을 채취해 와.				레인저 마스터
QUEST_JOBSTEP_20150317_000035	野蠻人大師	바바리안 마스터				
QUEST_JOBSTEP_20150317_000036	透過劍鋒相對就能知道對手的本領。{nl}如果你向我證明自己有資格成為戰士，我會引導你成為真正的野蠻人。	검과 검을 맞댐으로써 상대의 기량을 알 수 있지.{nl}내게 전사의 자격을 증명하면 진정한 바바리안으로 이끌어 주겠다.				
QUEST_JOBSTEP_20150317_000037	你有足夠的資格成為戰士。{nl}讓我幫你成為真正的野蠻人吧！	전사의 자격은 충분하다. {nl}내가 진짜 바바리안으로 만들어 주지.				
QUEST_JOBSTEP_20150317_000038	我很了解你想透過槍變強的心意。{nl}如果你完成我給你的課題，我就教你槍術。	창으로써 강해지고 싶은 당신의 마음은 잘 알겠습니다.{nl}제가 드리는 과제를 수행해 오신다면 저의 창술을 가르쳐 드리겠습니다.				
QUEST_JOBSTEP_20150317_000039	請將荊棘心山溝的格羅爾的皮革、落雨林的切波勒的毒針，{nl}還有礦山村莊的幽格普斯的黑粉拿給我。	가시마음골의 그롤의 가죽. 낙우림의 체이퍼러의 독침.{nl}그리고 광산 마을의 유코푸스의 검은 가루를 제게 가져오세요.				
QUEST_JOBSTEP_20150317_000040	我很清楚你想變強的決心。{nl}你有資格與槍同在。	당신이 가진 강해지고자 하는 마음에 대해 잘 알겠어요.{nl}당신이라면 창과 함께할 자격이 있습니다.				하플라이트 서브 마스터
QUEST_JOBSTEP_20150317_000041	念力法師大師	사이코키노 마스터				
QUEST_JOBSTEP_20150317_000042	如果你想要了解念力法師，要不要暫時當一下我的助手。{nl}我跟你保證這會是非常棒的領域。	사이코키노를 이해하고 싶다면 잠시 나의 조수로 일해보는 것은 어떻겠나.{nl}굉장히 멋진 분야라는 것은 내 보증 하겠네.				
QUEST_JOBSTEP_20150317_000043	先到荊棘心山溝，獵殺梅修花怪，收集花蕊給我。{nl}很容易就壞掉，要取得完整的並不容易。	일단 가시마음골에 있는 메슘을 잡아서 꽃술을 모아 주게.{nl}쉽게 망가져서 온전한 걸 구하기가 쉽지 않아.				
QUEST_JOBSTEP_20150317_000044	很好。梅修花怪的花蕊都還活著。{nl}現在給你看一個真的有趣的。	좋군. 메슘의 꽃술이 온전히 살아 있어.{nl}이제 정말 재미있는 것을 보게 될 걸세.				
QUEST_JOBSTEP_20150317_000045	你現在去荊棘心山溝的琴塔拉街道。{nl}在我設置的梅修花怪人偶上噴灑這個藥水，然後將結果告訴我。	이제 가시마음골의 긴타라 가도로 가게.{nl}내가 설치해 놓은 실험용 메슘 인형에 이 물약을 뿌리고 결과를 내게 알려 주게.				
QUEST_JOBSTEP_20150317_000046	你說周圍的梅修花怪攻擊你？{nl}梅修花怪當梅修花怪人偶是朋友，可以算是成功了。{nl}	주변의 메슘들이 자네를 공격했다고?{nl}메슘 인형을 메슘이 친구라 받아 들였으니 성공이라고 봐야겠어.{nl}				
QUEST_JOBSTEP_20150317_000047	辛苦了。{nl}你已經成為一個好助手，那我就正式教你關於念力法師的事。	수고했네.{nl}좋은 조수가 되어 주었으니 사이코키노에 대해 본격적으로 가르쳐 주겠네.				
QUEST_JOBSTEP_20150317_000048	我研究的主題是關於將念力轉移成物質型態的方法論。{nl}什麼意思呢.. 就是用藥來轉移精神。	내 연구의 주제는 염력을 물질의 형태로 전이하는 방법론에 대한 것일세.{nl}무슨 말인고 하니.. 약을 써서 세뇌를 전파하겠다는 거야.				
QUEST_JOBSTEP_20150317_000049	鎖鏈法師大師	링커 마스터				
QUEST_JOBSTEP_20150317_000050	對鎖鏈法師來說，天賦是非常重要的。{nl}把心門關上非常簡單，但打開他人的心房卻需要特殊的天賦。{nl}	링커에겐 자질이라는 게 굉장히 중요해요. {nl}마음을 닫아 버리는 건 아주 쉽지만 남의 마음을 여는 건 특수한 자질이 필요하답니다.{nl}				링커 서브 마스터
QUEST_JOBSTEP_20150317_000051	我要考驗你，看看你有沒有那種天賦。	당신에게 그 자질이 있는지 제가 시험해 보겠어요.				링커 서브 마스터
QUEST_JOBSTEP_20150317_000052	好。在考驗之前，需要一些材料。{nl}到關口路將刺球怪的尖刺和貝里克洛的碎片拿給我。	좋아요. 시험에 앞서 약간의 재료들이 필요해요.{nl}관문로에서 던볼의 가시와 벨리글러의 조각을 제게 가져다주세요.				
QUEST_JOBSTEP_20150317_000053	真厲害。{nl}但這只是考驗的準備。	훌륭하군요.{nl}하지만 이건 시험의 준비일 뿐이에요.				링커 서브 마스터
QUEST_JOBSTEP_20150317_000054	考驗開始。{nl}關口路上有個異面世界的裂縫。{nl}	시험을 시작하겠어요. {nl}관문로에 이면세계의 찢어진 틈이 있죠.{nl}				
QUEST_JOBSTEP_20150317_000055	雖然對普通人來說只是現實，但如果有鎖鏈法師的天賦就能找到異面世界。{nl}請尋找位於該處的書並帶來給我。	보통 사람들에겐 그저 현실이지만 링커의 자질이 있다면 그 이면세계를 찾을 수 있을 것입니다.{nl}그곳에 있는 책을 찾아 저에게 가져다주세요.				링커 서브 마스터
QUEST_JOBSTEP_20150317_000056	還沒好嗎？{nl}前往關口路，去我標示在地圖上的地方就好了。	아직이신가요?{nl}관문로로 가셔서 제가 지도에 표시해드린 곳으로 곧장 가시면 됩니다.				
QUEST_JOBSTEP_20150317_000057	把書帶來啦。這樣你就通過考驗了。{nl}請把那本書當做踏上鎖鏈法師之路的決心來讀。	책을 찾아오셨군요. 이것으로 시험은 통과입니다.{nl}그 책을 링커의 길에 대한 마음가짐 삼아 읽어 주세요.				링커 서브 마스터
QUEST_JOBSTEP_20150317_000058	工兵的技能啊…那當然要繳學費囉。{nl}不是交給我，希望你把捐款交給柯拉佩達的牧師大師。{nl}大概5,000銀幣吧？	새퍼의 기술이라.. 그럼 당연히 수업료를 내야겠지.{nl}나에게 말고, 클라페다에 계신 클레릭 마스터님께 기부금을 내주었으면 해.{nl}한 5,000 실버 정도?				새퍼 마스터
QUEST_JOBSTEP_20150317_000059	啊！還有一件事。{nl}我有藏東西在夏奧雷伊西邊森林的普魯德之島。{nl}在你去柯拉佩達之前，先去找到那個東西，然後幫我將東西還給柯拉佩達的原來主人。{nl}{nl}	아차차, 한 가지 더.{nl}샤울레이 서쪽 숲의 플루데 섬에 숨겨 둔 물건이 있어. {nl}클라페다에 가기 전에 그걸 먼저 찾아서 클라페다의 원래 주인들에게 돌려줘.{nl}{nl}				
QUEST_JOBSTEP_20150317_000060	哦，這個 好像在哪看過這東西…嗯… 好眼熟…{nl}既然是給我的，那我就感激地收下囉！	어, 이거. 어디서 본 물건인데.. 음.. 낯이 익은데..{nl}일단 주시는 거니 감사히 받을게요!				잡화 상인 미리나
QUEST_JOBSTEP_20150317_000061	哎呀，這是我弄丟的工具嗎？{nl}謝啦。我把它掉在哪了啊	어라, 이건 내가 잃어버린 연장인데?{nl}고맙소. 여태 어디에 있다 온 거람.				장비 상인 던켈
QUEST_JOBSTEP_20150317_000062	你忘記捐款啦？{nl}要捐5,000銀幣。	기부금은 깜빡 잊은거야?{nl}5,000 실버라고.				새퍼 마스터
QUEST_JOBSTEP_20150317_000063	牧師大師	클레릭 마스터				
QUEST_JOBSTEP_20150317_000064	我以女神之名感謝你。{nl}我答應你，我會把這捐款用在被怪物傷害的人身上。{nl}	여신의 이름으로 감사드립니다.{nl}이 성금은 몬스터에게 피해를 당하신 분들께 쓰이도록 약속드리지요.{nl}				클레릭 마스터
QUEST_JOBSTEP_20150317_000065	我本來是竊賊，因為有所領悟才完全金盆洗手的。{nl}但我一直掛念著一件事…我要趁這個機會做個了結{nl}	난 원래 도둑이었는데 좀 깨달은 바가 있어서 이번에 완전히 손을 씻었거든.{nl}하지만 계속 걸리는 게 있어서.. 이번 기회에 완전히 끝을 낼 거야{nl}				새퍼 마스터
QUEST_JOBSTEP_20150317_000066	不論如何辛苦了。{nl}之後互相學習，好好相處吧！	어쨌든 정말 수고했어.{nl}앞으로 가르침을 주거니 받거니 하면서 잘 지내 보자고.				
QUEST_JOBSTEP_20150317_000067	我在找書，是利迪亞夏班大人的4本書。{nl}如果你幫我找我，我就教你我的技術。	책을 찾고 있어요. 리디아 샤펜님의 책 네 권이요.{nl}책을 찾는 일을 도와주신다면 제 기술을 가르쳐 드리겠어요.				
QUEST_JOBSTEP_20150317_000068	聽說那本書原本是在礦山村莊，但在布貝襲擊事件當時遺失了。{nl}請前往布貝前哨基地所在之處。	그 책은 광산 마을에 있었는데 부베 습격 사건 때 잃어버렸다고 들었어요.{nl}부베 전초기지가 있는 곳으로 가보세요.				헌터 마스터
QUEST_JOBSTEP_20150317_000069	就是這本書啊。如果你夢想成為最強的弓箭手，應該會需要此書。{nl}把書全部收集到之後，就為你製作手抄本。	이 책이군요. 최고의 궁수를 꿈꾸신다면 이 책이 필요할 거예요.{nl}책을 전부 모으게 된다면 사본을 만들어 드리죠.				헌터 마스터
QUEST_JOBSTEP_20150317_000070	下一本書在弩箭手大師手上。{nl}他之前聽說在找梅羅葛的皮革，也許用那個可以跟他交易那本書。	다음 권은 쿼렐슈터 마스터가 가지고 계세요.{nl}예전에 메로그의 가죽을 찾으시던데, 어쩌면 그걸로 거래해 볼 수도 있겠네요.				
QUEST_JOBSTEP_20150317_000071	還沒從獵人大師那裡取得梅羅葛的皮革？	헌터 마스터에게서 메로그 가죽은 아직인가?				
QUEST_JOBSTEP_20150317_000072	這種程度品質算相當不錯，獵人大師應該也挺有成就感的。{nl}這書你拿去吧。{nl}	이 정도면 꽤 질이 좋군. 헌터 마스터도 꽤 보람이 있겠어. {nl}책은 자네가 가져가게. {nl}				쿼렐슈터 마스터
QUEST_JOBSTEP_20150317_000073	梅羅葛在落雨林，弩箭手大師在柯拉佩達。{nl}有可能被別人先下手為強，所以趕快去吧！	메로그는 낙우림에, 쿼렐슈터 마스터는 클라페다에 있어요. {nl}다른 사람이 선수 칠 수도 있으니 어서 가보세요.				
QUEST_JOBSTEP_20150317_000074	下一本書在柯拉佩達的弓箭手大師手上。{nl}他並不是很無情的人，如果恭敬地拜託一下，他應該很樂意把書交給你。{nl}	다음 책은 클라페다의 아처 마스터가 가지고 있을 거예요.{nl}그다지 매정한 사람은 아니니 공손히 부탁하면 흔쾌히 책을 내어 줄 거예요.{nl}				헌터 마스터
QUEST_JOBSTEP_20150317_000075	聽說他目前正在幫忙修理崩塌的城牆。{nl}據說有岩石被搬運到礦山村莊，把它帶過去給弓箭手大師也是拜託他的方法。	그는 지금 무너진 성벽을 수리하는 일을 돕고 있다고 하는군요.{nl}광산 마을에 옮겨둔 바위가 있다고 하니 그걸 가져다주는 것도 부탁의 한 방법이겠지요.				헌터 마스터
QUEST_JOBSTEP_20150317_000076	這石頭是獵人大師送的嗎？{nl}如果是利迪亞夏班之書，你可以直接借走啊。總之謝謝你。	이 바위는 헌터 마스터가 보낸 건가?{nl}리디아 샤펜의 책이라면 그냥 와서 빌려 가도 되는데. 어쨌든 고마워.				아처 마스터
QUEST_JOBSTEP_20150317_000077	最後一本書在柯拉佩達的遊俠大師手中。{nl}把這個袋子交給她就行了。{nl}我也能親自去找她，但我們的關係並不能自在地見面。	마지막 책은 클라페다의 레인저 마스터가 가지고 있어요.{nl}그녀에게 이 주머니를 전해 주시면 될 거예요.{nl}제가 직접 가도 되지만 편히 얼굴 볼 사이가 아니라서요.				헌터 마스터
QUEST_JOBSTEP_20150317_000078	請別問我原因。一事歸一事 ，因為我不太想和她碰面是事實。	이유는 묻지 마세요. 일은 일이고 별로 마주치고 싶지 않은 건 사실이니까요.				헌터 마스터
QUEST_JOBSTEP_20150317_000079	這袋子是…你應該是代替獵人大師過來的吧？{nl}幫我把這本書交給她。{nl}	이 주머니는.. 헌터 마스터 대신 왔나 보지?{nl}자. 그녀에게 이 책을 전해 줘.{nl}				레인저 마스터
QUEST_JOBSTEP_20150317_000080	她都這樣低頭了，我也不想把事情弄僵。	그 여자가 그렇게까지 고개를 숙인다는데 나까지 뻣뻣하게 구는 건 사양이야.				레인저 마스터
QUEST_JOBSTEP_20150317_000081	有這些皮革應該夠了。{nl}請在其他人拿走之前，快去找弩箭手大師。	이 정도 가죽이면 충분할 거예요.{nl}다른 사람이 가져가기 전에 어서 쿼렐슈터 마스터께 다녀 오세요.				헌터 마스터
QUEST_JOBSTEP_20150317_000082	有了這些石頭一定能在整修城牆時派上用場。{nl}請快拿去給弓箭手大師。	이 정도 바위라면 분명 성벽을 보수하는데 요긴하게 쓰일 거예요.{nl}어서 아처 마스터에게 가져다 주세요.				헌터 마스터
QUEST_JOBSTEP_20150317_000083	想學我技術的人是你嗎？{nl}剛好我在找人幫我找利迪亞夏班的書，你來得正好。你會幫我吧？	내 기술을 배우고 싶다는 사람이 자네인가.{nl}마침 리디아 샤펜의 책을 찾아 줄 사람을 찾고 있었는데 잘됐군. 도와 줄거지?				
QUEST_JOBSTEP_20150317_000084	聽說礦山村莊有1本，但是在遭到布貝襲擊後就消失不見了。{nl}肯定是在布貝前哨基地裡。	광산 마을에 1권이 있다는데, 부베한테 습격당하면서 사라졌다는군.{nl}분명 부베 전초기지에 있을거야.				쿼렐슈터 마스터
QUEST_JOBSTEP_20150317_000085	哦，沒錯。就是這個。{nl}對夢想成為弩箭手的你會很有幫助的。{nl}如果你把書都收集到手，大叔我就給你手抄本。	오오, 그래. 이거야, 이거.{nl}쿼렐슈터를 꿈꾸는 자네에게도 큰 도움이 될 거야.{nl}책을 다 모으게 된다면 이 아저씨가 사본을 주도록 하지.				쿼렐슈터 마스터
QUEST_JOBSTEP_20150317_000086	還剩下三本。{nl}如果把錢塞給獵人大師，也許能得到其中一本…{nl}	앞으로 세 권 남았네.{nl}그 중의 한 권은 아마 헌터 마스터에게서 돈을 쥐어주면 구할 수 있지 싶은데..{nl}				쿼렐슈터 마스터
QUEST_JOBSTEP_20150317_000087	問題是我是個窮光蛋。	문제는 내가 빈털터리라네.				쿼렐슈터 마스터
QUEST_JOBSTEP_20150317_000088	你說的是我擁有的利迪亞夏班之書嗎？{nl}給我5,000銀幣就轉讓給你。	제가 가지고 있는 리디야 샤펜님의 책 말씀이십니까.{nl}5,000 실버에 양도해 드리지요.				헌터 마스터
QUEST_JOBSTEP_20150317_000089	雖然很丟臉，但拜託你了。{nl}大概5,000銀幣應該就行了。{nl}	그럼 면목없지만 부탁함세.{nl}아마 5,000 실버 정도면 될 거야.{nl}				쿼렐슈터 마스터
QUEST_JOBSTEP_20150317_000090	5,000銀幣… 好的。沒錯。{nl}我就照約定把書交給你。	5,000 실버.. 네. 맞습니다.{nl}약속대로 책을 넘겨 드리지요.				헌터 마스터
QUEST_JOBSTEP_20150317_000091	來…下一本書就在弓箭手大師手中。{nl}那傢伙正在拼命修理城牆，如果帶些石材過去，他應該會很開心吧？{nl}雖然大叔我也能親自帶過去..…唉唷喂！ 我的腰…	자.. 다음 책은 아처 마스터가 가지고 있을 거야.{nl}녀석은 아직도 성벽 수리에 매달리고 있으니 석재라도 갖다 주면 좋아하지 않을까?{nl}이 아저씨가 직접 갖다 줄 수도 있겠지만.. 아이고!! 허리야..				쿼렐슈터 마스터
QUEST_JOBSTEP_20150317_000092	下一本書應該在弓箭手大師手中。{nl}他並不是很無情的人，如果恭敬地拜託一下，也許他會把書交給你。{nl}	다음 책은 아처 마스터가 가지고 있을 거야.{nl}그리 매정한 사람은 아니니 공손하게 부탁하면 책을 내어 줄 지도 몰라.{nl}				쿼렐슈터 마스터
QUEST_JOBSTEP_20150317_000093	聽說他目前正在柯拉佩達幫忙修復崩塌的城牆。{nl}據說有岩石被搬運到礦山村莊，如果把它帶過去，那傢伙一定會很感動的。	듣기론 그는 클라페다의 무너진 성벽을 수리하는 것을 돕는 중이라더군.{nl}광산 마을에 옮겨둔 바위가 있다고 하니 갖다주면면 그 녀석, 분명 감동할 거야.				쿼렐슈터 마스터
