QUEST_JOBSTEP_20150317_000725	利迪亞夏班在大開門戶之前就面臨此問題，這讓她傷透腦筋。因此許多史學家定論，無論是偶然抑或是女神的庇佑，如果她沒遇見大師造箭者，就沒有所謂星之塔的建設，而且也無法創建門戶。{nl}	 리디아 샤펜이 이런 문제에 직면한 것은 그녀가 아직 자신의 문호를 크게 열기 전이었기에 그녀의 곤란은 자못 심각했다. {nl} 따라서 우연이든 여신의 섭리든 그녀가 마스터 플레쳐를 만나지 못했다면, 이후 별의 탑의 건설과 그에 따른 문호의 창건도 없었다는 것이 여러 사학자들의 정설이다. {nl}				리디아 샤펜과 플레쳐
QUEST_JOBSTEP_20150317_000726	他是世界上最出名的造箭者，後人口中所說的大師造箭者指的就是他。但大師造箭者與利迪亞夏班不同，他並沒有確切的本名。{nl}	 세상의 수많은 화살제조자 가운데 가장 유명해지고 이후 마스터 플레쳐라면, 바로 이 사람을 가리키는 대명사가 된 인물이지만, 리디아 샤펜과 달리 마스터 플레쳐의 본명은 확실치 않다. {nl}				리디아 샤펜과 플레쳐
QUEST_JOBSTEP_20150317_000727	自從他成名之後，人們就時常稱他為大師造箭者，也許當代的人們普遍知道他的本名，但卻意外地隨著歲月的流逝被埋沒了。{nl}根據幾個傳承下來的說法，他的本名叫約翰布拉克史密斯，但這個名字本身可能不是專有名詞而是普通名詞，包含這點在內尚有許多不足為信的理由，因此無法得到學者們的認同。{nl}	 그의 시대부터 그는 마스터 플레쳐란 이름으로 자주 불렸고, 당대의 사람들은 혹시 보편적으로 알고 있었을 본명은 의외로 세월의 흐름에 묻혔다. {nl} 몇몇 전승에 의하면 그의 본명은 존 블랙스미스(John Blacksmith)라고 하지만, 이 이름 자체가 고유명사가 아니라 보통명사일 가능성을 비롯하여 신뢰할 수 없는 이유가 많아 학자들의 지지를 얻지 못하고 있다. {nl}				리디아 샤펜과 플레쳐
QUEST_JOBSTEP_20150317_000728	總而言之，利迪亞夏班可說是得到大師造箭者這樣的造箭名匠，所以日後才得以正式聚集勢力，並且為星之塔的竣工創舉打下基礎。{nl}不幸的是，大師造箭者製造箭矢的秘訣在當時並不公開，如今已經埋沒在歲月的洪流之中，因此便更難為人所知。{nl}	 아무튼, 리디아 샤펜은 마스터 플레쳐란 화살 명인을 얻으며, 이후 본격적인 세력을 모을 수 있었고, 별의 탑의 완공 같은 대역사도 시작할 기반을 얻게 되었다고 볼 수 있다. {nl}불행히도 마스터 플레쳐의 화살제조 비법은 그 당시에도 비밀이었고, 지금은 세월에 묻혀 더욱 알기 어렵다. {nl}				리디아 샤펜과 플레쳐
QUEST_JOBSTEP_20150317_000729	若說後代弓箭手還有一絲希望，那就是大師造箭者的造箭技術很有可能是緣於女神的祝福。{nl}因此無論是誰，得到女神的祝福者就能製造出與大師造箭者所打造、利迪亞夏班所使用的箭矢相同的箭。{nl}	다만 후대의 궁수들에게 실낱 같은 희망이라면, 마스터 플레쳐의 화살제조는 여신의 축복에 기인한 바가 크다는 점이다. {nl}따라서 누구든 여신의 축복을 얻은 사람은 마스터 플레쳐가 만들고, 리디아 샤펜이 사용한 화살과 동일한 화살을 만들 수 있다는 점이다. {nl}				리디아 샤펜과 플레쳐
QUEST_JOBSTEP_20150317_000730	另一個希望就是大師造箭者為了不讓造箭的秘訣失傳，確實把造箭秘法書藏在某處了。	또 하나 희망을 추가한다면, 마스터 플레쳐는 그의 비법이 실전되지 않도록 제조비법서를 어딘가에 확실히 비장해두었다는 점이다. 				리디아 샤펜과 플레쳐
QUEST_JOBSTEP_20150317_000731	基於此點，雖然快速的生產力是大師造箭者的天賦，但製造強大箭矢的秘訣如今也許還沉睡世界上的某個地方等著世人發現。	그런 점에서 마스터 플레쳐의 빠른 생산력은 전적으로 그의 재능이었지만, 강력한 화살을 만드는 비법은 지금이라도 세상 어딘가에서 발견될 날을 기다리며 잠들어 있다고 볼 수 있다.				리디아 샤펜과 플레쳐
QUEST_JOBSTEP_20150317_000732	利迪亞夏班的轉折點	리디아 샤펜의 교차선				
QUEST_JOBSTEP_20150317_000733	{s35}{nl}利迪亞夏班的轉折點{/}	{s35}{nl}리디아 샤펜의 교차선{/}				리디아 샤펜의 교차선
QUEST_JOBSTEP_20150317_000734	王室中流傳著一個記錄：國王卡杜梅爾問利迪亞夏班:[就算是妳應該也射不中藏在樹或石頭後面的靶子吧？]此時利迪亞夏班簡明扼要地應了一聲，同時用響亮的弓弦聲代替回答並命中標靶。{nl}然而有關於此，王室的正式記錄與流傳於世間的傳說中尚有未提及的部分。那就是卡杜梅爾國王說出那番話的目的，其實不單純是為了測試利迪亞夏班的箭術。{nl}	 국왕 카듀멜이 리디아 샤펜에게 나무나 바위 뒤에 숨은 표적은 그녀라도 어쩔 수 없지 않겠냐고 물었을 때 리디아 샤펜은 간명한 그러면서 또렷한 활시위 소리로 대답을 대신하여 표적을 명중시켰다는 기록이 왕실에 전한다. {nl} 그러나 왕실의 공식기록이나 세간에 전하는 이와 관련한 전설에서 언급하지 않는 내용이 있다. 그것은 카듀멜 국왕이 그런 말을 한 배경이 단순히 리디아 샤펜의 궁술을 시험하기 위한 것이 아니었다는 점이다.{nl}				리디아 샤펜의 교차선
QUEST_JOBSTEP_20150317_000735	更重要的是，當時利迪亞夏班所射中的標靶是什麼東西，不，正確說來，她射中的是什麼人才是重點。{nl}王室的記錄與民間的傳說談到此軼事時，兩者都未提到這是什麼時候發生的事。{nl}	그리고 그 보다 더 중요한 사실은 그 떼 리디아 샤펜이 맞춘 표적이 무엇인지, 아니 정확히 말하면 누구였는지가 중요한 사실이다. {nl}왕실의 기록과 민간의 전설에서 이 일화를 다룰 때는 항상 이것이 언제 일어난 일인지 그 시기를 언급하지 않는다. {nl}				리디아 샤펜의 교차선
QUEST_JOBSTEP_20150317_000736	只是把焦點放在利迪亞夏班強大的箭術上，將其當成英雄故事來說。{nl}之所以如此是有原因的。{nl}因為這軼事是發生在內戰時期的最後階段。與部分流傳的傳說不同之處是，露克立斯與卡杜梅爾國王的士兵戰鬥時，並不是在大地要塞的最後一層戰死。流傳露克立斯是因為某個原因，不想讓外人進入大地要塞最後一層的中心。{nl}	다만 리디아 샤펜의 대단한 활솜씨에 초점을 맞춘 영웅담으로만 소개한다. {nl}거기에는 그럴 수밖에 없는 이유가 있다. {nl}그 이유는 이 일화가 내전기의 막바지에 일어난 일이라는 점이다. 일부 알려진 전설과 달리 루클리스는 대지의 요새의 마지막 층에서 카듀멜 국왕의 병사들에게 전사한 것이 아니었다. 루클리스는 어떤 이유로 대지의 요새 마지막 층의 심장부에 외부인을 들이고 싶지 않았다고 전해진다.{nl}				리디아 샤펜의 교차선
QUEST_JOBSTEP_20150317_000737	所以露克立斯是在大地要塞淪陷之前逃出要塞，而卡杜梅爾國王則調動士兵追擊他。{nl}追擊到最後，露克立斯被逼到懸崖邊。	그래서 루클리스는 대지의 요새가 함락되기 직전 요새를 탈출하였고, 카듀멜 국왕은 병사들을 움직여 그를 추적하였다. {nl}그 추적의 끝에서 루클리스는 벼랑 끝으로 몰렸다. 				리디아 샤펜의 교차선
QUEST_JOBSTEP_20150317_000738	那個懸崖上正好有個巨大的岩石，露克立斯背對那塊岩石，以正面朝向懸崖的狀態對付國王的士兵。{nl}當露克立斯背對那塊岩石時，追擊中的國王弓箭手就攻擊不到露克立斯了。{nl}如果是其他場所，就能藉由繞道從對面與左右包圍猛烈射箭，但這類攻擊對懸崖陣型是行不通的。{nl}	그 벼랑에 마침 커다란 바위가 있어 루클리스는 그 바위를 등지고 정면으로는 벼랑을 마주 보는 자세로 국왕의 병사를 상대하였다.{nl} 루클리스가 그 바위를 등지자 추적하던 국왕의 궁수들은 루클리스를 공격할 수 없었다. {nl} 다른 장소였다면 돌아가 맞은편과 좌우에서 포위하여 화살을 퍼부을 수도 있었겠지만, 벼랑이란 진형은 그런 공격을 할 수 없는 장소였다. {nl}				리디아 샤펜의 교차선
QUEST_JOBSTEP_20150317_000739	因為沒有弓箭手能越過懸崖在虛空中進行攻擊，因此卡杜梅爾國王簡直是一個勁的把士兵逼向懸崖邊。{nl}	벼랑을 지나 허공에 뜬 상태로 공격할 수 있는 궁수가 없었기에 카듀멜 국왕은 계속 병사들을 그야말로 벼랑 끝으로 내몰았다. {nl}				리디아 샤펜의 교차선
QUEST_JOBSTEP_20150317_000740	然而露克立斯和剩餘的部下卻不斷擊退進犯的士兵，他們硬撐了一天一夜，展現出超越人類極限的能力，而卡杜梅爾國王的士兵見狀便開始動搖。{nl}甚至有士兵與將領看見露克立斯英雄的奮戰之姿而深感佩服，因內心動搖而抗命。{nl}卡杜梅爾國王原本就不受百姓歡迎，因此無法在這種情況下追究麾下的將領，但也不能因此而等到露克立斯筋疲力盡或等他活活餓死。{nl}	그러나 루클리스와 그의 남은 부하들은 밀려오는 병사들을 끊임없이 물리쳤고, 그들이 하루 밤낮을 버티는 인간의 한계를 넘어선 능력을 보이자, 카듀멜 국왕의 병사들도 동요하기 시작하였다.{nl} 심지어 루클리스의 영웅적인 분투에 감명을 받은 병사와 장군들의 심적 동요로 항명이 있을 정도였다.{nl} 본래 백성들에게 인기가 없던 카듀멜 국왕은 이런 상황에서 휘하의 장수들을 다그치지 못 하였고, 그렇다고 루클리스가 지쳐 죽거나 굶어 죽기를 기다릴 수도 없었다. {nl}				리디아 샤펜의 교차선
QUEST_JOBSTEP_20150317_000741	在這種情況下，卡杜梅爾國王想出的詭計就是他向利迪亞夏班提出的問題。{nl}當然，利迪亞夏班並沒有因為卡杜梅爾國王的挑釁而上當，也沒為了展現自己的能力而用驚人的曲射殺害岩石後的露克立斯。{nl}此處又有另一個隱情。{nl}	그리고 이런 상황에서 카듀멜 국왕이 꾀를 낸 것이 바로 리디아 샤펜에게 던진 질문이다.{nl}물론 리디아 샤펜이 카듀멜 국왕의 도발에 넘어가 자신의 실력을 보여주려고 바위 뒤의 루클리스를 신묘한 곡사로 죽인 것은 아니다. {nl}여기에는 또 다른 사연이 겹쳐있다. {nl}				리디아 샤펜의 교차선
QUEST_JOBSTEP_20150317_000742	說到那個隱情，身為後代的我們也只能猜測那是利迪亞夏班的師父的願望，而親手結束某人生命的心情一定是既痛苦又複雜。{nl}總之因為這個事件，世人皆知迪亞夏班能射穿被岩石擋住的標靶，但她當時複雜心情的轉折點是無從推度的。{nl}	그러나 그 사연이야 어쨌든 스승의 희망이자 자신의 사형의 목숨을 제 손으로 끊은 리디아 샤펜의 감정이 얼마나 아프고 복잡했을지는 후대의 우리로서는 그저 추측만 할 수 있을 따름이다.{nl} 여하간 이 사건으로 사람들은 리디아 샤펜이 조준하는 교차선은 능히 바위로 가려진 표적도 뚫을 수 있다는 사실을 알게 되었지만, 그녀가 그날 품은 복잡한 감정의 교차선은 헤아릴 수 없음이다. {nl}				리디아 샤펜의 교차선
QUEST_JOBSTEP_20150317_000743	利迪亞夏班的箭尾槽	리디아 샤펜의 오늬				
QUEST_JOBSTEP_20150317_000744	{s35}{nl}利迪亞夏班的箭尾槽{/}	{s35}{nl}리디아 샤펜의 오늬{/}				리디아 샤펜의 오늬
QUEST_JOBSTEP_20150317_000745	根據傳聞，這是某天發生在星之塔的事。{nl}某天，利迪亞夏班的門徒在星之塔中展開爭論。{nl}據說多名門徒在訓練後閒聊途中出現這種話題。{nl}[無論再好的弓，如果使用者能力拙劣就無法把威力發揮出來。因此重要的是自身的能耐。]{nl}其他門徒反駁了某門徒的這種主張。{nl}	 전하는 바로는 이것은 어느 날 별의 탑에서 일어난 일이라고 한다.  {nl}어느 날 별의 탑에서 리디아 샤펜의 제자들 사이에 논쟁이 벌어졌다.{nl}여러 제자가 훈련 후에 모여 여담을 나누는 중에 이런 이야기가 나왔다고 한다. {nl}“아무리 좋은 활이라도 쓰는 사람의 실력이 나쁘다면 위력을 낼 수 없네. 그러므로 결국 중요한 것은 일신의 실력이란 말일세.”{nl}한 제자의 이런 주장에 다른 제자가 반박하였다.{nl}				
QUEST_JOBSTEP_20150317_000746	[你忘了弓箭手的基本。何謂弓箭手？ 弓箭手就是使用弓這種工具的人。沒有弓的弓箭手能存在嗎？ 就算自身的武藝再高，如果用刀與槍施展武藝，那怎麼能成為弓箭手呢？ 總歸，弓箭手必須依賴工具。]{nl}	“자네는 궁수의 기본을 망각하고 있네. 궁수란 무엇인가? 궁수는 활이란 도구를 다루는사람일세. 활 없는 궁수가 존재할 수 있단 말인가? 제아무리 일신의 무예가 드높아도 칼과 창으로 무예를 펼친다면, 어떻게 궁수가 될 수 있단 말인가? 결국, 궁수는 도구에 종속된 개념일세.”{nl}				
QUEST_JOBSTEP_20150317_000747	於是有不同見解的門徒再次反駁。{nl}[既然你說工具重要，那我們就針對這點來說吧。{nl}所謂的弓的定義到底是甚麼？就像石弓這種比較不需要使用者能力的武器，以及會被使用者能力大幅左右的巫蠱師的武器，弓箭手能使用的武器也是很多元的。{nl}巫蠱師的風箭是很難以弓去控制的，即使用再好的材料打造，沒經驗的人就是很難上手。]{nl}	그러자 그와 견해를 달리하는 제자가 재차 반박하였다.{nl}“자네의 말이 도구가 중요한 것이라니 그 말을 놓고 봄세. {nl}대체 활의 범위란 뭐란 말인가? 석궁처럼 사람의 실력을 비교적 적게 타는 무기와 무고사의 무기처럼 쓰는 사람의 실력에 크게 좌우되는 무기처럼 궁수의 무기 범위에서도 다양성이 존재한다네. {nl}무고사의 바람화살은 숙달하기 어려운 활로써 아무리 좋은 재질로 잘 만들어도 경험이 없는 사람은 제대로 사용하기 어려운 무기이네. {nl}				
QUEST_JOBSTEP_20150317_000748	然而石弓或十字弓真的是誰都能使用的武器嗎？其實不然。{nl}依照你的主張，必須有工具才會有弓箭手的存在，但這是錯的。	그렇다고 석궁이나 십자궁이 과연 아무나 사용 가능한 무기인가 하면 그 또한 아닐세. {nl} 자네의 주장대로 도구가 있어야만 궁수가 존재한다는 것은 그런 면에서 잘못된 주장일세. 				리디아 샤펜의 오늬
QUEST_JOBSTEP_20150317_000749	 這就像人不進食就會餓死，所以人命不如食物，亦即人的一生必須依靠食物的主張。{nl}你打算主張的是人是為了生存而吃飯，而不是為了吃飯而生存嗎？]{nl}於是另一個門徒又對此提出其他見解。{nl}[你們在談論弓箭手之路時只看一面。{nl}你們沒注意到的是無論是名弓或是神射手，他們所利用的其實是風。{nl}	 이것은 마치 사람이 밥을 먹지 않으면, 죽으니 사람의 삶이 밥보다 못하며 사람의 인생은 밥에 종속되었단 주장이나 마찬가지일세.{nl} 자네는 살기 위해 밥을 먹는 것이지 밥을 먹기 위해 산다고 주장할 셈인가?”{nl} 그러자 또 다른 제자가 이에 대해 다른 견해를 제기했다.{nl}“자네들은 궁수의 길을 논함에 있어 한 가지 면만을 보고 있네. {nl} 자네들이 놓치고 있는 점은 어떤 명궁이든 명사수이든 결국 그들이 이용하는 것은 바람이란 사실일세. {nl}				
QUEST_JOBSTEP_20150317_000750	如果沒有風和空氣，射出的箭與子彈就無法命中目標，如此一來就不會有神射手的存在，而名弓又有什麼意義呢？ 最後，對弓箭手而言，最重要的是去感覺風的流動，並讓自己的意志與風結合。]{nl}	 활이 쏘아내는 화살이나 탄자를 받아 목표까지 날라주는 바람과 공기가 없다면 어떻게 명사수가 존재할 것이며, 명궁은 또 무슨 의미란 말인가? 결국, 궁수에게 중요한 것은 바람의 결을 느끼고 그 바람의 결에 자신의 의지를 싣는 일일세.”{nl}				
QUEST_JOBSTEP_20150317_000751	此後門生的爭論也不斷持續下去，並演繹出更多樣有趣的主張與理論。{nl}最後門生也開始好奇他們的師父─利迪亞夏班是怎麼想的。{nl}所以門生都去找利迪亞夏班，並把至今的對話告訴他等待利迪亞夏班解答。{nl}	이후로도 제자들의 논쟁은 끝이 없이 이어졌고, 더 다양하고 재미있는 주장과 이론들이 전개되었다고 한다. {nl} 그리고 마침내 제자들은 그들의 스승인 리디아 샤펜이 어떻게 생각하는지 궁금해지고야 말았다.{nl} 그래서 제자들은 리디아 샤펜에게 몰려가 여태껏 자신들이 나눈 대화를 들려준 후 스승님의 말씀을 기다렸다.{nl}				리디아 샤펜의 오늬
QUEST_JOBSTEP_20150317_000752	據說當門生來找利迪亞夏班時，她正好在用箭頭的尖刃剝栗子吃，並且危險地跨坐在星之塔的欄杆上。{nl}	제자들이 리디아 샤펜에게 왔을 때; 마침 그녀는 화살촉의 날을 이용해 밤을 까먹으며 별의 탑의 난간에 위태하게 걸터앉아 있었다고 전해진다.{nl}				리디아 샤펜의 오늬
QUEST_JOBSTEP_20150317_000753	 利迪亞夏班繼續吃著栗子並傾聽門徒們反覆論述的主張，他暫時安靜地不動聲色，接著就用手指撥弄自己吃完後堆積下來的栗子殼，並從中拿起某樣東西如此說道。{nl}[這是什麼？]{nl}一名反應快、眼力好的門徒最先回答。{nl}[那是栗子的內皮。]{nl}	 리디아 샤펜은 제자들을 맞은 자세 그대로 하던 대로 밤을 먹으며 제자들의 되풀이된 주장을 경청한 다음, 잠시 조용히 있다가 이윽고 손가락으로 자신이 먹으며 모아 놓은 밤껍질 무더기를 손가락으로 뒤적거린 후 그 가운데서 무엇을 들어 올리더니 이렇게 말했다고 전한다.{nl}“이것이 무엇이냐?”{nl}눈치 빠르고 시력이 좋은 제자 하나가 가장 먼저 대답했다.{nl}“보늬입니다.”{nl}				
QUEST_JOBSTEP_20150317_000754	那確實是栗子內皮，因此其他門徒也點點頭等待師父開口說話。{nl}於是利迪亞夏班便繼續說下去。{nl}[不對。這是我的箭尾。]{nl}	 그것이 보늬란 것은 명백한 사실이었기에 다른 제자들도 고개를 끄덕이며 스승의 다음 말을 기다렸다. {nl}그리고 리디아 샤펜의 말이 이어졌다.{nl}“아니다. 이것은 나의 오늬이니라.”{nl}				
QUEST_JOBSTEP_20150317_000755	聽說利迪亞夏班說完就把栗子的內皮夾在手指之間，並用它包住時常置於身邊的箭的尾端，將之當成箭尾槽般使用並把箭射向天際。{nl}據說利迪亞夏班用奇怪的方法消除門徒們的爭論，並從欄杆上縱身而下留下不知所措的門徒們離去。{nl}	그렇게 말한 리디아 샤펜은 먹던 밤에서 나온 보늬를 손가락 사이에 끼운 후 항상 곁에 두던 자신의 활에 화살끝을 재어 감싸 오늬처럼 사용해 하늘을 향해 쏘았다고 한다.  {nl}제자들의 논쟁을 이상한 방법으로 잠재운 리디아 샤펜은 걸터앉은 난간에서 내려와 어리둥절해하는 제자들을 남겨두고 그 자리를 떠났다고 전해진다. {nl}				리디아 샤펜의 오늬
QUEST_JOBSTEP_20150317_000756	利迪亞夏班和侏儒怪	리디아 샤펜과 럼펠스틸스킨				
QUEST_JOBSTEP_20150317_000757	{s35}利迪亞夏班和侏儒怪{/} 	{s35}리디아 샤펜과 럼펠스틸스킨{/} 				리디아 샤펜과 럼펠스틸스킨
QUEST_JOBSTEP_20150317_000758	王國各地流傳著有關利迪亞夏班的趣聞軼事。{nl}甚至從歷史上的記錄來看，連可斷言利迪亞夏班不曾去過之處，也有其行經村莊時所發生的軼聞。{nl}這種軼聞的內容很荒誕，比方說有龍出沒，或者出現性格不同於我們所知的魔族與利迪亞夏班行打賭之約等。{nl}	 왕국 곳곳에는 리디아 샤펜에 관련된 일화들이 전해집니다. {nl} 심지어 역사상 기록으로 보아 리디아 샤펜이 한 번도 간 적이 없다고 단언할 수 있는 지방에서도 리디아 샤펜이 그들의 마을을 들렀을 때 일어났다는 일화가 존재할 정도입니다. {nl} 이런 일화들은 드래곤이 나타나는 터무니 없는 내용이나 우리가 아는 바와 다른 이상한 성격의 마족이 나타나 리디아 샤펜과 내기를 한다든가 하는 황당한 이야기를 합니다. {nl}				리디아 샤펜과 럼펠스틸스킨
QUEST_JOBSTEP_20150317_000759	儘管如此，該地的居民卻依然深信不疑，自己的故鄉出現在與利迪亞夏班有關的故事之中，這讓他們感到驕傲。{nl}	그럼에도 불구하고 해당 지역의 주민들은 그 이야기들을 믿어 의심치 않으며, 리디아 샤펜과 관련된 이야기에 자신들의 고향이 나온다는 사실에 자부심을 품곤 합니다.{nl}				리디아 샤펜과 럼펠스틸스킨
QUEST_JOBSTEP_20150317_000760	相較於因為內戰而早死的露克立斯，或不常離開自己所建造的塔的弗羅里等人，利迪亞夏班確實曾在世界各地遊走冒險，所以很適合出現在那些軼聞之中。{nl}從現在起所描述的故事也是那些傳說之一。{nl}	아마도 내전으로 일찍 죽은 루클리스나 자신이 세운 탑에서 떠나는 일이 많지 않았던 플러리 등에 비해 리디아 샤펜은 확실히 세상 곳곳을 다니며 모험행을 했으니 그런 이야기에 잘 들어맞는 인물인 까닭일 것입니다. {nl}이제부터 적을 이야기도 그런 이야기들 가운데 하나입니다. {nl}				리디아 샤펜과 럼펠스틸스킨
QUEST_JOBSTEP_20150317_000761	也許故事本身不屬實，而且除了今日，在當時應該也是荒謬絕倫，但這種故事具有生命力並且流傳至今，此一事實就能說明其符合利迪亞夏班的性情。	비록 이야기 자체는 사실이 아닐지 모르고, 현재는 물론 그 당시로써도 황당하고 허무맹랑한 이야기일지 모르나 이런 이야기가 생명력을 갖고 지금까지 전한다는 사실 자체가 해당 이야기가 리디아 샤펜의 성정과 부합한다 할 수 있습니다.				리디아 샤펜과 럼펠스틸스킨
QUEST_JOBSTEP_20150317_000762	 有一天，利迪亞夏班獨自離開某個村莊並走在夜道上。{nl}利迪亞夏班看到有個旅人無力地癱坐在林間小路後便停下腳步。{nl}利迪亞夏班出於好奇而開口問他。{nl} [請問您怎麼會在深夜裡坐在森林中呢？]{nl}跌坐在地的旅人在利迪亞夏班接連的催促下勉強回答。{nl}旅人所回答的內容如下。{nl}	 어느 날 리디아 샤펜이 홀로 어떤 마을을 벗어나 밤길을 걷고 있었습니다.{nl} 리디아 샤펜은 한 나그네가 숲길에 힘없이 주저앉아 있는 것을 보고 멈췄습니다.{nl} 호기심에 리디아 샤펜이 그에게 물었습니다.{nl} “한밤에 이런 숲에서 왜 그러고 계십니까?”{nl}주저앉아 있던 나그네는 리디아 샤펜의 거듭된 재촉에 겨우 입을 열었습니다. {nl} 나그네가 말한 사연은 다음과 같았습니다.{nl}				
QUEST_JOBSTEP_20150317_000763	據說旅人在幾天前經過這片森林時遇到名為侏儒怪的魔族。{nl}旅人被捲進魔族的紛爭中，結果就和侏儒怪展開比試。{nl}	 나그네는 며칠 전 이 숲을 지나다 럼펠스틸스킨이란 이름을 지닌 마족을 만났다고 합니다. {nl} 나그네는 그 마족에게 말려들어 결국 럼펠스틸스킨과 시합을 하게 되었답니다.{nl}				리디아 샤펜과 럼펠스틸스킨
QUEST_JOBSTEP_20150317_000764	雖然贏得勝利就能得到豐厚的獎賞，但與魔族的比試並不簡單，結果旅人便在比試中輸掉了。這下旅人只能唉聲嘆氣，等著把說好的獎賞拱手交給侏儒怪。{nl}利迪亞夏班聽了原委後，心中萌生想會會那個名為侏儒怪的魔族的念頭。{nl}他答應旅人會盡力幫忙。{nl}過了一段時間，利迪亞夏班所等待的侏儒怪出現了。	 이길 경우 보상이 크긴 했지만, 마족과의 시합이 쉬울 리가 없어서 결국 패배하게 되었고, 이제 럼펠스틸스킨과 약속한 대가를 치러야 할 때가 되어 한숨 쉬며 기다리고 있다는 말이었습니다.{nl} 리디아 샤펜은 사연을 듣고 럼펠스틸스킨이란 문제의 마족을 만나고 싶어졌습니다. {nl}그리고 최대한 나그네를 돕기로 약속했습니다.{nl} 시간이 흐르고 기다리던 럼펠스틸스킨이 나타났습니다. 				리디아 샤펜과 럼펠스틸스킨
