QUEST_JOBSTEP_20150317_001770	尋訪弩箭手大師	쿼렐슈터 마스터 찾아가기				
QUEST_JOBSTEP_20150317_001771	取得利迪亞夏班的祕石拓本	리디아 샤펜의 비석 탁본 구해오기				
QUEST_JOBSTEP_20150317_001772	弩箭手大師想透過簡單的考驗任務取得利迪亞夏班的拓本。請向女神的古院中的利迪亞夏班的祕石取得拓本。	쿼렐슈터 마스터는 간단한 시험 과제로 리디아 샤펜의 탁본을 원하고 있습니다. 여신의 옛뜰에 위치한 리디아 샤펜의 비석에서 탁본을 떠 오세요.				
QUEST_JOBSTEP_20150317_001773	交給弩箭手大師	쿼렐슈터 마스터에게 전달				
QUEST_JOBSTEP_20150317_001774	已成功取得拓本。請回去交給弩箭手大師。	탁본을 구하는데 성공했습니다. 쿼렐슈터 마스터에게 돌아가 전해 주세요.				
QUEST_JOBSTEP_20150317_001775	尋訪流氓大師	로그 마스터 찾아가기				
QUEST_JOBSTEP_20150317_001776	請去找佩迪米安的流氓大師。	페디미안에 있는 로그 마스터를 찾아 가세요.				
QUEST_JOBSTEP_20150317_001777	使用煙幕彈甩掉5個怪物	연막탄을 사용하여 몬스터 5마리 따돌리기				
QUEST_JOBSTEP_20150317_001778	流氓大師說在他教導你它的技術之前，你需要通過試驗。到大教堂的大會路上準備好的練習場，對湧入的怪物使用煙幕彈令他們陷入混亂，然後請消滅他們。	로그 마스터는 자신의 기술을 가르쳐 주기 전에 시험이 필요하다고 합니다. 대성당의 대회로에 준비된 연습장에서 몰려드는 몬스터들에게 연막탄을 사용하여 혼란에 빠뜨린 뒤, 처치하세요.				
QUEST_JOBSTEP_20150317_001779	向流氓大師報告	로그 마스터에게 보고				
QUEST_JOBSTEP_20150317_001780	似乎已經通過流氓大師準備的所有考驗。請回去向流氓大師報告。	로그 마스터가 준비한 시험을 모두 통과한 것 같습니다. 로그 마스터에게 돌아가 보고하세요.				
QUEST_JOBSTEP_20150317_001781	尋訪重裝步兵大師	하플라이트 마스터 찾아가기				
QUEST_JOBSTEP_20150317_001782	請去找夏奧雷伊西邊森林的重裝步兵大師。	샤울레이 서쪽 숲의 하플라이트 마스터를 찾아 가세요.				
QUEST_JOBSTEP_20150317_001783	消滅大教堂正殿的鬼影凱伊洛	대성당 본당의 섀도게일러 처치				
QUEST_JOBSTEP_20150317_001784	重裝步兵大師希望你在接受教導前，先將刀騎兵大師約定要消滅的鬼影凱伊洛搶先一步消滅掉，讓他吃點苦頭。照她的期望到大教堂正殿消滅鬼影凱伊洛後成功歸來吧！	하플라이트 마스터는 가르침을 받기에 앞서 하카펠 마스터가 처치하기로 약속한 섀도게일러를 한 발 먼저 처치하여 골탕을 먹일 것을 바라고 있습니다. 그녀의 바램대로 대성당 본당의 섀도게일러를 처치하고 와 주세요.				
QUEST_JOBSTEP_20150317_001785	向重裝步兵大師報告	하플라이트 마스터에게 보고				
QUEST_JOBSTEP_20150317_001786	已成功消滅鬼影凱伊洛。請回去向重裝步兵大師報告。	섀도게일러를 처치하는데 성공했습니다. 하플라이트 마스터에게 돌아가 보고하세요.				
QUEST_JOBSTEP_20150317_001787	消滅暗影凱伊洛	섀도게일러 처치				
QUEST_JOBSTEP_20150317_001788	尋訪野蠻人大師	바바리안 마스터 찾아가기				
QUEST_JOBSTEP_20150317_001789	請和夏奧雷伊東邊森林的野蠻人對話。	샤울레이 동쪽 숲의 바바리안과 대화해 보세요.				
QUEST_JOBSTEP_20150317_001790	消滅大教堂正殿的石鯨 	대성당 본당의 예쿱 처치				
QUEST_JOBSTEP_20150317_001791	野蠻人大師希望你能比其他覬覦石鯨的人先一步消滅石鯨。請到大教堂正殿消滅耶庫。	바바리안 마스터는 예쿱을 노리는 다른 사람들보다 먼저 가서 예쿱을 처치하길 바라고 있습니다. 대성당 본당에 있는 예쿱을 처치하세요.				
QUEST_JOBSTEP_20150317_001792	向野蠻人大師報告	바바리안 마스터에게 보고				
QUEST_JOBSTEP_20150317_001793	已成功消滅耶庫。請回去向野蠻人大師報告。	예쿱을 처치하는데 성공했습니다. 바바리안 마스터에게 돌아가 보고하세요.				
QUEST_JOBSTEP_20150317_001794	消滅耶庫	예쿱 처치				
QUEST_JOBSTEP_20150317_001795	尋訪侍從大師	스콰이어 마스터 찾아가기				
QUEST_JOBSTEP_20150317_001796	請和佩迪米安的侍從大師對話。	페디미안에 있는 스콰이어 마스터와 대화해 보세요.				
QUEST_JOBSTEP_20150317_001797	使用捆索繩	포박 포승줄 사용하기				
QUEST_JOBSTEP_20150317_001798	侍從大師要求將捆索繩練習到得心應心為止。到大教堂的至聖所，以怪物為對象練習捆索繩吧！	스콰이어 마스터는 포박 포승줄을 손에 익을때까지 연습하라고 합니다. 대성당의 지성소에 있는 몬스터를 상대로 포박 포승줄을 연습해 보세요.				
QUEST_JOBSTEP_20150317_001799	回去找侍從大師	스콰이어 마스터에게 돌아가기				
QUEST_JOBSTEP_20150317_001800	捆索繩似乎已經完全得心應手了。請回去向侍從大師報告。	포박 포승줄이 완전히 손에 익은 것 같습니다. 스콰이어 마스터에게 돌아가 보고하세요.				
QUEST_JOBSTEP_20150317_001801	尋訪百夫長大師	센츄리온 마스터 찾아가기				
QUEST_JOBSTEP_20150317_001802	請去拜訪大餓鬼路上的百夫長大師。	큰아귀 길에 있는 센츄리온 마스터를 찾아 가세요.				
QUEST_JOBSTEP_20150317_001803	消滅增岩森林的曼陀花獸	점층바위 숲의 콜리멘시아 처치				
QUEST_JOBSTEP_20150317_001804	據說百夫長大師必須具備可以指揮別人的實力。到增岩森林，消滅曼陀花獸，證明你的實力。	센츄리온 마스터는 다른 사람을 지휘할 정도의 실력이 필요하다고 합니다. 점층바위 숲의 콜리멘시아를 처치하여 실력을 증명하세요.				
QUEST_JOBSTEP_20150317_001805	回去找百夫長大師	센츄리온 마스터에게 돌아가기				
QUEST_JOBSTEP_20150317_001806	已成功消滅曼陀花獸。請向百夫長大師報告。	콜리멘시아를 처치하는데 성공했습니다. 센츄리온 마스터에게 보고하세요.				
QUEST_JOBSTEP_20150317_001807	消滅曼陀花獸	콜리멘시아 처치				
QUEST_JOBSTEP_20150317_001808	弓箭手大師的呼喚	아처 마스터의 부름				
QUEST_JOBSTEP_20150317_001809	到柯拉佩達，弓箭手大師正在找你。	클라페다에 있는 아처 마스터가 당신을 찾고 있습니다				
QUEST_JOBSTEP_20150317_001810	消滅露克立斯街道的斯帕娜史霍	루클리스 거리의 스파나스혼 처치				
QUEST_JOBSTEP_20150317_001811	弓箭手大師說需要評估你的能力。請在露克立斯街道消滅斯帕娜史霍後回去找弓箭手大師	아처 마스터는 기량을 잴 수 있는 것이 필요하다고 합니다. 루클리스 거리에서 스파나스혼을 처치하고 아처 마스터에게 돌아가세요				
QUEST_JOBSTEP_20150317_001812	已成功消滅斯帕娜史霍。向回去向弓箭手大師報告。	스파나스혼을 처치하는데 성공하였습니다. 아처 마스터에게 돌아가 보고하세요.				
QUEST_JOBSTEP_20150317_001813	消滅斯帕娜史霍	스파나스혼 처치				
QUEST_JOBSTEP_20150317_001814	遊俠大師的呼喚	레인저 마스터의 부름				
QUEST_JOBSTEP_20150317_001815	到柯拉佩達，遊俠大師正在找你。	클라페다의 레인저 마스터가 당신을 찾고 있습니다				
QUEST_JOBSTEP_20150317_001816	消滅冷清市集的地心蟲王	스산한 장터의 리버피드 처치				
QUEST_JOBSTEP_20150317_001817	遊俠大師說他對自己的工作感到懷疑，希望能像其他大師一樣做有幫助的事。請到冷清市進消滅地心蟲王。	레인저 마스터는 자신의 일에 회의감이 든다면서 다른 마스터들처럼 도움이 되는 일을 해 보고 싶다고 합니다. 스산한 장터에서 리버피드를 처치하세요.				
QUEST_JOBSTEP_20150317_001818	已成功消滅地心蟲王。請向遊俠大師報告。	리버피드를 처치하는데 성공했습니다. 레인저 마스터에게 보고하세요.				
QUEST_JOBSTEP_20150317_001819	消滅地心蟲王	리버피드 처치				
QUEST_JOBSTEP_20150317_001820	弩箭手大師的呼喚	쿼렐슈터 마스터의 부름				
QUEST_JOBSTEP_20150317_001821	到柯拉佩達，弩箭手大師正在找你。	클라페다에 있는 쿼렐슈터 마스터가 당신을 찾고 있습니다				
QUEST_JOBSTEP_20150317_001822	消滅市中心街道的神殿射手	중심시가의 템플슈터 처치				
QUEST_JOBSTEP_20150317_001823	弩箭手大師說自己的門徒誤事，害得自己顏面掃地。請代替弩箭手大師的門徒消滅市中心街道的神殿射手。	쿼렐슈터 마스터는 자신의 제자들이 일을 그르치는 바람에 체면이 구겨졌다고 합니다. 쿼렐슈터 마스터의 제자 대신 중심시가에서 템플슈터를 처치하세요.				
QUEST_JOBSTEP_20150317_001824	向弩箭手大師	쿼렐슈터 마스터에게 보고				
QUEST_JOBSTEP_20150317_001825	已成功消滅神殿射手。請回去向弩箭手大師報告。	템플슈터를 처치하는데 성공했습니다. 쿼렐슈터 마스터에게 돌아가 보고하세요.				
QUEST_JOBSTEP_20150317_001826	射殺神殿射手	템플슈터 사살				
QUEST_JOBSTEP_20150317_001827	工兵大師的呼喚	새퍼 마스터의 부름				
QUEST_JOBSTEP_20150317_001828	到夏奧雷伊東邊森林，工兵大師正在找你。	샤울레이 동쪽 숲에 있는 새퍼 마스터가 당신을 찾고 있습니다				
QUEST_JOBSTEP_20150317_001829	向露克立斯街道的遠古石龜獸取得天然瑪瑙石	루클리스 거리의 락토르투가에게서 천연 마노석 획득				
QUEST_JOBSTEP_20150317_001830	工兵大師想擁有新陷阱所需的天然瑪瑙石。請消滅露克立斯街道的遠古石龜獸，取得天然瑪瑙石後回去找工兵大師。	새퍼 마스터는 새로운 함정에 필요한 천연 마노석을 갖고싶어 합니다. 루클리스 거리의 락토르투가를 처치하고 천연 마노석을 획득하여 새퍼 마스터에게 돌아가세요.				
QUEST_JOBSTEP_20150317_001831	已獲得天然瑪瑙石，和工兵大師對話。	천연 마노석을 획득하였습니다. 새퍼 마스터와 대화하세요.				
QUEST_JOBSTEP_20150317_001832	獲得天然瑪瑙石	천연 마노석 획득				
QUEST_JOBSTEP_20150317_001833	獵人大師的呼喚	헌터 마스터의 부름				
QUEST_JOBSTEP_20150317_001834	到夏奧雷伊東邊森林，獵人大師正在找你。	샤울레이 동쪽 숲에서 헌터 마스터가 당신을 찾고 있습니다				
QUEST_JOBSTEP_20150317_001835	於冷清市集中消滅大量牛頭人	스산한 장터에서 흥분한 미노타우르스 처치				
QUEST_JOBSTEP_20150317_001836	獵人大師說最近米諾牛頭怪常常出沒，你身為獵人得具備消滅那種怪物的能力。請到冷清市集消滅米諾牛頭怪並帶回巨大獠牙做為證據。	헌터 마스터는 미노타우르스가 나타났다면서 헌터라면 그 몬스터를 처치할 능력은 있어야 한다고 합니다. 스산한 장터에서 미노타우로스를 처치하고 그 증거로 거대한 송곳니를 가져 오세요.				
QUEST_JOBSTEP_20150317_001837	交給獵人大師	헌터 마스터에게 전달				
QUEST_JOBSTEP_20150317_001838	已消滅興奮的米諾牛頭怪，並獲得巨大獠牙作為證物之用。請交給獵人大師。	흥분한 미노타우르스를 처치하고 그 증거물로 거대한 송곳니를 얻었습니다. 헌터 마스터에게 전해 주세요.				
QUEST_JOBSTEP_20150317_001839	獲得巨大獠牙	거대한 송곳니 획득				
QUEST_JOBSTEP_20150317_001840	巫蠱師大師的呼喚	무고사 마스터의 부름				
QUEST_JOBSTEP_20150317_001841	到佩迪米安，巫蠱師大師正在找你。	페디미안의 무고사 마스터가 당신을 찾고 있습니다				
QUEST_JOBSTEP_20150317_001842	消滅市中心街道的拉查托特	중심시가의 라자토드 처치				
QUEST_JOBSTEP_20150317_001843	巫蠱師大師正在說明有關毒的免疫的重要性。請在市中心街道消滅拉查托特再回去找巫蠱師大師。	무고사 마스터는 독의 면역에 대한 중요성에 대해 말하고 있습니다. 중심시가에서 라자토드를 처치하고 무고사 마스터에게 돌아가세요				
QUEST_JOBSTEP_20150317_001844	向巫蠱師大師報告	무고사 마스터에게 보고				
QUEST_JOBSTEP_20150317_001845	已成功消滅拉查托特。請回去向巫蠱師大師報告。	라자토드를 퇴치하는데 성공했습니다. 무고사 마스터에게 돌아가 보고하세요.				
QUEST_JOBSTEP_20150317_001846	斥候大師的呼喚	스카우트 마스터의 부름				
QUEST_JOBSTEP_20150317_001847	到佩迪米安，斥候大師正在找你。	페디미안의 스카우트 마스터가 당신을 찾고 있습니다				
QUEST_JOBSTEP_20150317_001848	消滅露克立斯街道的鐵甲僵屍 	루클리스 거리의 데드본 처치				
QUEST_JOBSTEP_20150317_001849	想得到斥候大師的教導的話，得先具備相當的實力。請到露克立斯街道消滅鐵甲僵屍再回到斥候大師那裏去吧。	스카우트 마스터는 가르침을 받으려면 어느 정도 실력은 되어야 한다고 합니다. 루클리스 거리에서 데드본을 처치하고 스카우트 마스터에게 돌아가세요.				
QUEST_JOBSTEP_20150317_001850	向斥候大師報告	스카우트 마스터에게 보고				
QUEST_JOBSTEP_20150317_001851	已成功消滅鐵甲僵屍，和斥候大師對話。	데드본을 처치하는데 성공하였습니다. 스카우트 마스터와 대화하세요.				
QUEST_JOBSTEP_20150317_001852	流氓大師的呼喚	로그 마스터의 부름				
QUEST_JOBSTEP_20150317_001853	請去找佩迪米安的流氓大師。	페디미안의 로그 마스터를 찾아 가세요.				
QUEST_JOBSTEP_20150317_001854	和流氓大師對決	로그 마스터와 대련				
QUEST_JOBSTEP_20150317_001855	流氓大師要你透過對決展現實力。請在階梯上的空地和流氓大師對決並贏得勝利。	로그 마스터는 대련으로 실력을 보이라고 합니다. 계단 위 공터에서 로그 마스터와의 대련에서 승리하세요.				
QUEST_JOBSTEP_20150317_001856	與流氓大師對話	로그 마스터와 대화				
QUEST_JOBSTEP_20150317_001857	已在對決中戰勝流氓大師。請再次和流氓大師對話	로그 마스터와의 대련에서 승리하였습니다. 로그 마스터와 다시 대화하세요				
QUEST_JOBSTEP_20150317_001858	戰勝流氓大師	로그 마스터 제압				
QUEST_JOBSTEP_20150317_001859	造箭者大師的呼喚	플레쳐 마스터의 부름				
QUEST_JOBSTEP_20150317_001860	到棲身的樹木山溝，造箭者大師正在找你。	머무르는 나뭇골의 플레쳐 마스터가 당신을 찾고 있습니다				
QUEST_JOBSTEP_20150317_001861	收集易燃石	잘 타는 돌멩이 수집				
QUEST_JOBSTEP_20150317_001862	造箭者大師說要是你願意幫他取得易燃石的話，他就願意收你為弟子，但感覺他好像只是說說客套話而已。請到市中心街道消滅約納喬雷並收集易燃石。	플레쳐 마스터는 잘 타는 돌멩이를 구해다 준다면 제자로 받아들여 주겠지만 왠지 빈말을 하고 있는 듯한 느낌입니다. 중심시가에서 요나졸렘을 처치하고 잘 타는 돌멩이를 수집하세요.				
QUEST_JOBSTEP_20150317_001863	成功取得易燃石。請轉交給造箭者 大師。	잘 타는 돌멩이를 구했습니다. 플레쳐 마스터에게 전해 주세요.				
QUEST_JOBSTEP_20150317_001864	收集易燃石頭	잘 타는 돌맹이 수집	QUEST_JOBSTEP_20150317_001861	收集易燃石	잘 타는 돌멩이 수집	
QUEST_JOBSTEP_20150317_001865	徵集挑戰者[黑暗騎兵轉職]	도전자 모집[슈바르츠라이터 전진]				
QUEST_JOBSTEP_20150317_001866	黑暗騎兵大師的呼喚	슈바르츠라이터 마스터의 부름				
QUEST_JOBSTEP_20150317_001867	到加橋森林，黑暗騎兵大師正在找你。	덧댄다리 숲에 있는 슈바르츠라이터 마스터가 당신을 찾고 있습니다				
QUEST_JOBSTEP_20150317_001868	和黑暗騎兵大師練習對決	슈바르츠라이터 마스터와 대련				
QUEST_JOBSTEP_20150317_001869	黑暗騎兵大師說槍和劍雖重要，憎恨更重要。請贏得和黑暗騎兵大師的對決練習	슈바르츠라이터 마스터는 총과 검도 중요하지만 한 가지 더, 증오가 필요하다고 합니다. 슈바르츠라이터 마스터와 대련하여 승리하세요				
QUEST_JOBSTEP_20150317_001870	與黑暗騎兵大師對話	슈바르츠라이터 마스터와 대화				
QUEST_JOBSTEP_20150317_001871	在對決中戰勝了黑暗騎兵大師，和黑暗騎兵大師對話。	슈바르츠라이터 마스터와의 대련에서 승리하였습니다. 슈바르츠라이터 마스터와 대화하세요.				
QUEST_JOBSTEP_20150317_001872	黑暗騎兵的認可	슈바르츠라이터의 인정				
QUEST_JOBSTEP_20150317_001873	尋訪牧師大師	클레릭 마스터 찾아가기				
QUEST_JOBSTEP_20150317_001874	請去找柯拉佩達的牧師大師對話。	클라페다에 있는 클레릭 마스터를 찾아 대화해 보세요.				
QUEST_JOBSTEP_20150317_001875	在冷清市集尋找野花花蕊	스산한 장터에서 야생화 꽃술 구하기				
QUEST_JOBSTEP_20150317_001876	牧師大師的藥草已經快用完了，現在急需野花花蕊。請到冷清市集尋找野花花蕊並轉交給牧師大師。	클레릭 마스터는 약초가 동이 났다면서 야생화 꽃술을 원하고 있습니다. 스산한 장터에서 야생화 꽃술을 구해 클레릭 마스터에게 가져다 주세요.				
QUEST_JOBSTEP_20150317_001877	回去找牧師大師	클레릭 마스터에게 돌아가기				
QUEST_JOBSTEP_20150317_001878	已取得野花花蕊。請交給牧師大師。	야생화 꽃술을 구했습니다. 클레릭 마스터에게 전달해 주세요.				
QUEST_JOBSTEP_20150317_001879	野花花蕊	야생화 꽃술				
QUEST_JOBSTEP_20150317_001880	在市中心街道回收遺失的聖物	중심 시가에서 잃어버린 성물 회수				
QUEST_JOBSTEP_20150317_001881	聖火祭司大師說，前來佩迪米安的聖物列隊遭怪物襲擊後聖物就被奪走了。請在市中心街道尋找遺失的聖物並交給 聖火祭司大師。	크리비 마스터는 페디미안으로 오던 성물 행렬이 몬스터의 습격을 받아 빼앗겨 버렸다고 합니다. 중심 시가에서 잃어버린 성물을 찾아서 크리비 마스터에게 전달하세요.				
QUEST_JOBSTEP_20150317_001882	交給聖火祭司大師	크리비 마스터에게 전달				
QUEST_JOBSTEP_20150317_001883	已找回遺失的聖物。請交給聖火祭司大師。	잃어버린 성물을 되찾았습니다. 크리비 마스터에게 전달해 주세요.				
QUEST_JOBSTEP_20150317_001884	請在市中心街道尋找%s並將之回收	중심 시가에서 %s 찾아 회수하기				
QUEST_JOBSTEP_20150317_001885	消滅毒魔蛙圖圖	투투 처치				
QUEST_JOBSTEP_20150317_001886	到柯拉佩達和聖水祭司大師對話。	클라페다에 위치한 프리스트 마스터와 대화하세요.				
QUEST_JOBSTEP_20150317_001887	勘查露克立斯街道	루클리스 거리 탐색				
QUEST_JOBSTEP_20150317_001888	據說露克立斯街道上瀰漫著邪惡的氣息。請前往露克立斯街道尋找邪惡氣息的根源。	루클리스 거리에 사악한 기운이 넘쳐난다고 합니다. 루클리스 거리로 가서 사악한 기운의 근원을 찾으세요.				
QUEST_JOBSTEP_20150317_001889	已清除露克立斯街道上的邪惡氣息的根源。請向柯拉佩達的聖水祭司大師報告。	루클리스 거리에 있는 사악한 기운의 근원을 제거했습니다. 클라페다에 있는 프리스트 마스터에게 보고하세요.				
QUEST_JOBSTEP_20150317_001890	清除邪惡氣息的根源	사악한 기운의 근원 처치				
QUEST_JOBSTEP_20150317_001891	獲取冷清市集的石鯨怪的精髓	스산한 장터에서 석화고래의 정수 획득				
QUEST_JOBSTEP_20150317_001892	邪靈祭司大師說透過帶回石鯨怪的精髓來進行一場試驗。請消滅徘徊於冷清市集的石鯨怪並帶回石鯨怪的精髓。	보코르 마스터는 석화고래의 정수를 가져오는 것으로 시험을 치르겠다고 합니다. 스산한 장터에 돌아다니는 석화고래를 처치해 석화고래의 정수를 가져 오세요.				
QUEST_JOBSTEP_20150317_001893	交給邪靈祭司大師	보코르 마스터에게 전달				
QUEST_JOBSTEP_20150317_001894	已取得石鯨怪的精髓。請把精髓帶去交給邪靈祭司大師。	석화고래의 정수를 얻었습니다. 보코르 마스터에게 정수를 가져다 주세요.				
QUEST_JOBSTEP_20150317_001895	消滅石鯨怪獲得%s	석화고래를 처치해서 %s 획득				
QUEST_JOBSTEP_20150317_001896	請去拜訪瑪凌波石窟的雕刻家泰斯拉。	마름포석골에 있는 조각가 테슬라를 찾아가세요.				
QUEST_JOBSTEP_20150317_001897	在市中心街道取得雕刻材料	중심시가에서 조각 재료 구하기				
QUEST_JOBSTEP_20150317_001898	雕刻家泰斯拉說如果你幫忙取得材料，他就有意收你為徒。請在市中心街道後院取得一捆原木。	조각가 테슬라는 자신이 원하는 재료를 구해다 주면 제자로 받아들일 용의가 있다고 합니다. 중심시가의 안뜰에서 아름드리 원목을 구하세요.				
QUEST_JOBSTEP_20150317_001899	請交給雕刻家泰斯拉	조각가 테슬라에게 전달				
QUEST_JOBSTEP_20150317_001900	已取得一捆原木。請交給雕刻家泰斯拉。	아름드리 원목을 구했습니다. 조각가 테슬라에게 전달해 주세요.				
QUEST_JOBSTEP_20150317_001901	消滅草綠樹精獲得%s	초록 우드 스피릿을 처치해서 %s 획득				
QUEST_JOBSTEP_20150317_001902	尋找材料	재료 찾기				
QUEST_JOBSTEP_20150317_001903	去拜訪佩迪米安的聖者大師	페디미안에 있는 사두 마스터를 찾아가세요.				
QUEST_JOBSTEP_20150317_001904	找出惡夢的原因並消除	악몽의 근원을 찾아서 제거				
QUEST_JOBSTEP_20150317_001905	聖者大師說那些經過露克立斯街道的人們正痛訴他們的惡夢，請找出惡夢的原因為何並解決。請到露克立斯街道尋找惡夢的原因。	사두 마스터는 루클리스 거리를 지나간 사람들이 악몽을 호소한다면서 그 근원을 찾아 제거해달라고 합니다. 루클리스 거리에서 그 원인을 찾아 보세요.				
QUEST_JOBSTEP_20150317_001906	已消滅妨礙睡眠原因的惡靈君主。請回去與聖者大師對話。	수면 방해의 근원인 스펙터 군주를 처치했습니다. 사두 마스터에게 돌아가 대화하세요.				
QUEST_JOBSTEP_20150317_001907	消滅妨礙睡眠的惡靈君主	수면을 방해하는 스펙터 군주 처치				
QUEST_JOBSTEP_20150317_001908	請去拜訪玉光懸崖的聖殿十字軍 大師。	옥빛서린 벼랑에 있는 팔라딘 마스터를 찾아가세요.				
QUEST_JOBSTEP_20150317_001909	消滅冷清市集的魔鬼鰩	스산한 장터의 라자펄 처치하기				
QUEST_JOBSTEP_20150317_001910	聖殿十字軍大師說想親自確認你的信仰虔誠度。請消滅聽說時常出沒於冷清市集的魔鬼吧！	팔라딘 마스터는 신앙심을 직접 확인하고 싶어합니다. 스산한 장터에 자주 출몰한다는 라자펄을 처치하세요.				
QUEST_JOBSTEP_20150317_001911	已經消滅魔鬼鰩。請回到聖殿十字軍大師那裏去。	라자펄을 처치했습니다. 팔라딘 마스터에게 돌아가 보고하세요.				
QUEST_JOBSTEP_20150317_001912	消滅魔鬼鰩	라자펄 처치				
QUEST_JOBSTEP_20150317_001913	與武僧大師對話	몽크 마스터와 대화				
QUEST_JOBSTEP_20150317_001914	到棲身的樹木山溝找武僧大師。	머무르는 나뭇골에 있는 몽크 마스터를 찾아가세요.				
QUEST_JOBSTEP_20150317_001915	消滅市中心街道的雷普斯並取得雷普斯的腳指甲	중심시가의 레푸스를 처치하고 레푸스의 발톱 획득				
QUEST_JOBSTEP_20150317_001916	武僧大師請你表現你非武僧這條路不可的決心當作證據。請消滅市中心街道的雷普斯並取得雷普斯的腳指甲。	몽크 마스터는 몽크가 되기 위한 다짐의 증거를 가져오라고 하였습니다. 중심시가에 있는 레푸스를 처치하고 증거인 레푸스의 발톱을 획득하세요.				
QUEST_JOBSTEP_20150317_001917	交給武僧大師	몽크 마스터에게 전달				
QUEST_JOBSTEP_20150317_001918	已經取得雷普斯的腳指甲。請交給武僧 大師。	레푸스의 발톱을 구했습니다. 몽크 마스터에게 가져다 주세요.				
QUEST_JOBSTEP_20150317_001919	消滅敏捷的雷普斯獲得 %s 	재빠른 레푸스를 처치하고 %s 획득				
QUEST_JOBSTEP_20150317_001920	消滅敏捷的雷普斯	재빠른 레푸스 처치				
QUEST_JOBSTEP_20150317_001921	與寬恕者大師對話	파드너 마스터와 대화				
QUEST_JOBSTEP_20150317_001922	請去拜訪水晶小溪的寬恕者大師。	수정개울에 있는 파드너 마스터를 찾아가세요.				
QUEST_JOBSTEP_20150317_001923	找回遺失的免死牌巨款	잃어버린 면죄부의 대금 되찾기				
