QUEST_JOBSTEP_20150714_002691	我們巫蠱師用毒從不猶豫。{nl}先讓你見識我們是如何戰鬥的。我會把弓和吹箭拿出讓你瞧瞧。{nl}	우리 무고사들은 독을 쓰는 것을 주저하지 않아.{nl}일단 우리가 어떻게 싸우는지 보여 줄게. 활이든 바람총이든 다 꺼내서 보여 줄 테니까.{nl}	QUEST_JOBSTEP_20150317_000316	我們巫蠱師對於施毒毫不猶豫。{nl}在你接受指導之前，我先展示一下怎麼戰鬥。不管是弓還是吹箭都拿出來，我會展示給你看。{nl}	우리 무고사들은 독을 쓰는 것을 주저하지 않아.{nl}가르침을 받기 전에 어떻게 싸우는지 보여 줄게. 활이든 바람총이든 다 꺼내서 보여 줄 테니까.{nl}	무고사 마스터
QUEST_JOBSTEP_20150714_002692	很好。我教你一招。{nl}這裡太窄了，你先到卡帕斯街道下面的空地。	좋아. 한 수 가르쳐주지.{nl}여긴 너무 좁으니 카파스 가도 아래의 공터로 먼저 가 있도록 해.	QUEST_JOBSTEP_20150323_002251	不管是弓還是吹箭都拿出來，我會展示給你看，快點進攻。	활이든 바람총이든 다 꺼내서 보여 줄 테니까 어서 덤벼.	무고사 서브 마스터
QUEST_JOBSTEP_20150714_002693	你還在這啊，應該是怕了吧？{nl}如果不是就到卡帕斯街道等我。	아직도 여기에 있는 걸 보니 겁이 나나 보지?{nl}그게 아니라면 카파스 가도에서 기다려.				무고사 서브 마스터
QUEST_JOBSTEP_20150714_002694	你真的想成為圓盾劍士嗎？ 既然如此就再次檢查你的盾牌吧。{nl}我選擇這條路的時候，是從取得4等級的盾牌開始的。	정말로 로델레로가 되고 싶은 건가? 그렇다면 자신의 방패부터 다시 살펴 봐.{nl}내가 이 길을 선택했을 때는 4단계의 방패를 구하는 것부터 시작했지.	QUEST_JOBSTEP_20150317_000319	如果你真心想成為圓盾劍士，那先檢查你的盾牌吧！{nl}當我選擇走上圓盾劍士之路的時候，我就是從取得6階的盾牌開始的。	네가 정말 로델레로가 되고 싶다면 자신의 방패부터 다시 살펴봐.{nl}내가 로델레로의 길을 선택했을 때는 6단계의 방패를 구하는 것부터 시작했지.	로델레로 서브  마스터
QUEST_JOBSTEP_20150714_002695	準備4階強化盾牌吧！{nl}需要確認你最起碼的意志，不是嗎？	4단계로 강화된 방패 정도는 준비하게.{nl}최소한의 의지는 확인해야 하지 않겠나.	QUEST_JOBSTEP_20150317_000320	準備6階強化盾牌吧！{nl}需要確認你最起碼的意志，不是嗎？	6단계로 강화된 방패 정도는 준비하게.{nl}최소한의 의지는 확인해야 하지 않겠나.	로델레로 마스터
QUEST_JOBSTEP_20150714_002696	像你這樣的人成為奇術師會讓我更有面子呢。{nl}但在那之前，希望你替我做件簡單的差事。{nl}	당신 같은 분이 쏘마터지로 입문하시는건 제가 더 영광이지요.{nl}하지만 그 전에, 간단한 심부름을 해 주셨으면 해요.{nl}	QUEST_JOBSTEP_20150317_000326	奇術師的魔法是魔法中非常難的其中之一，但如果是你，我可以好好帶領你。{nl}如果你答應我的委託，我就帶領你走上奇術師之路。	쏘마터지의 마법은 매우 어려운 마법 중의 하나이지만 저라면 잘 이끌어 드릴 수 있어요.{nl}제 부탁을 들어주신다면 당신을 쏘마터지의 길로 인도해 드릴게요.	쏘마터지 마스터
QUEST_JOBSTEP_20150714_002697	沒想到你這麼快就來找我了耶？{nl}我們這就馬上開始上課。	생각보다 빨리 찾으셨네요?{nl}지금 바로 수업을 시작하도록 하죠.	QUEST_JOBSTEP_20150323_002253	找得還擁快的嘛！{nl}好。我會待在你的身邊幫助你提升奇術師的能力。	생각보다 빨리 찾으셨네요?{nl}좋아요. 제가 당신 곁에서 쏘마터지의 능력을 이끌어 낼 수 있도록 도울게요.	쏘마터지 마스터
QUEST_JOBSTEP_20150714_002698	請在王陵1層取回巴普的津液、吉努特卡斯的尾巴碎片和普巫葛的驅動核。	왕릉 1층에서 바브의 진액, 지누테카스의 꼬리 파편과 부우크의 구동핵을 구해 오십시오.	QUEST_JOBSTEP_20150323_002254	到王之高原取回霍克瑪咒術師和霍克瑪看守者之血，{nl}最後再到札卡里耶爾交叉路取回霍克瑪戰鬥隊長之血。	왕의 고원에서 호그마 주술사와 호그마 파수꾼의 피,{nl}마지막으로 자카리엘 교차로에서 호그마 전투대장의 피를 구해 오십시오.	엘리멘탈리스트 서브 마스터
QUEST_JOBSTEP_20150714_002699	厲害。{nl}既然你完成任務了，如果你願意我們就馬上開始元素使的課程吧。	훌륭하군요.{nl}과제를 수행해 오셨으니 원하신다면 바로 엘레멘탈리스트의 수업을 시작하지요.	QUEST_JOBSTEP_20150317_000331	真厲害。{nl}你已完成我出的課題，如果你願意那就立刻開始修練吧！	훌륭하군요.{nl}과제를 수행해 오셨으니 원하신다면 바로 수련을 시작하지요.	엘리멘탈리스트 마스터
QUEST_JOBSTEP_20150714_002700	如果你和我對決並證明你的能力，我就把斥候的技能傳授給你。	나와 대련해서 네 실력을 증명한다면, 스카우트의 기술을 전수해 주지.	QUEST_JOBSTEP_20150317_000334	和我對決並證明你的實力，我就傳授你我的秘技。	나와 대련해서 네 실력을 증명한다면, 내 비장의 기술들을 전수해 주겠어.	스카우트 마스터
QUEST_JOBSTEP_20150714_002701	我要準備的東西很多，你先到卡帕斯街道下面的空地。{nl}我隨後就到。	준비할 게 많으니 먼저 카파스 가도 아래의 공터에 가 있어.{nl}금방 따라갈게.	QUEST_20150317_000158	不是擅長隱身和潛入就能萬事順利。{nl}同時具備了優秀的戰鬥技術才是真正的斥侯。	은신과 잠입에만 능하다고 만사가 아냐.{nl}전투기술도 갖추고 있어야 진정한 스카우트지.	스카우트 마스터
QUEST_JOBSTEP_20150714_002702	在這裡對決會傷到人。{nl}卡帕斯街道下方有不錯的空地，你先過去吧。	여기서 대련하는 건 민폐야.{nl}카파스 가도 아래쪽에 괜찮은 공터가 있으니까 먼저 가 있어.				스카우트 마스터
QUEST_JOBSTEP_20150714_002703	沒想到會有人想跟我這種人學東西，真感動。{nl}很好。把我的物品找回來就同意讓你當海賊。	이런 나에게도 뭘 배우겠다는 사람이 있다니 감동적이군.{nl}좋아. 내 물건들을 되찾아 준다면 커세어로 받아들여주지.	QUEST_JOBSTEP_20150317_000367	沒想到會有人想跟我這種人學東西，真感動。{nl}好。如果你幫忙找回我的物品，我就教你海賊的技術。	이런 나에게도 뭘 배우겠다는 사람이 있다니 감동적이군.{nl}좋아. 내 물건들을 되찾아 준다면 커세어의 기술을 가르쳐 주지.	커세어 마스터
QUEST_JOBSTEP_20150714_002704	那個愚蠢的副船長帶著所有東西逃往祈願森林了。{nl}也許是怪物拿走的也說不定。希望如此。	그 멍청한 부선장이 몽땅 챙겨서 기원의 숲으로 도망갔어.{nl}어쩌면 몬스터가 가지고 있을지도 모르지. 그랬으면 좋겠군.	QUEST_JOBSTEP_20150323_002257	那個愚蠢的副船長帶著所有東西逃往波塞林奇斯森林了。{nl}也許是怪物拿走的也說不定。希望如此。	그 멍청한 부선장이 몽땅 챙겨서 포슬린키스 숲으로 도망갔어.{nl}어쩌면 몬스터가 가지고 있을지도 모르지. 그랬으면 좋겠군.	커세어 마스터
QUEST_JOBSTEP_20150714_002705	全力攻過來吧。我會讓你見識如何用劍與盾戰鬥。{nl}你要明白一件事，根據你的能力，我可以教你更多也可以趕你走。	최선을 다해 덤벼라. 검과 방패로 어떻게 싸우는지 보여 주지.{nl}네 실력 여하에 따라 내가 널 더 가르칠 수도, 내칠 수도 있다는 것을 알아둬.	QUEST_JOBSTEP_20150317_000370	全力攻過來吧。我會讓你見識如何用劍與盾戰鬥。{nl}你要明白一件事，根據你的能力，我可以教你更多也可以趕你走。	최선을 다해 덤벼라. 검과 방패로 어떻게 싸우는지 보여 주지.{nl}네 실력 여하에 따라 내가 널 가르칠 수도, 내칠 수도 있다는 것을 알아둬.	로델레로 마스터
QUEST_JOBSTEP_20150714_002706	在這裡我看不到你真正的實力，我們在卡帕斯街道下面的空地見吧。	여기선 제대로 된 실력을 볼 수 없으니 카파스 가도 아래의 공터에서 보지.	QUEST_JOBSTEP_20150317_000371	盡全力都來不及了，還東張西望？	최선을 다해 덤벼도 모자를 판에 한눈을 팔 셈인가?	로델레로 마스터
QUEST_JOBSTEP_20150714_002707	你已經養成壞習慣了。不過還有改善的餘地。{nl}你也知道我的指導很嚴格，所以你必須做好心理準備。	나쁜 버릇이 몸에 배 있군. 하지만 개선의 여지는 있어.{nl}알다시피 내 가르침은 엄격하니까 단단히 각오해야 할 거야.	QUEST_JOBSTEP_20150317_000372	你已經養成壞習慣了。不過還有改進的餘地。{nl}我的指導很嚴格，所以你必須做好心理準備。	나쁜 버릇이 몸에 배 있군. 하지만 개선의 여지는 있어.{nl}내 가르침은 엄격하니까 단단히 각오해야 할 거야.	로델레로 마스터
QUEST_JOBSTEP_20150714_002708	想跟我學技能？{nl}如果你能把我所找的木頭帶過來，我會考慮看看。	내게 기술을 배우고 싶소?{nl}댁이 내가 찾는 나무를 구해 준다면 생각해 보리다.	QUEST_JOBSTEP_20150317_000386	你想學我的技術？{nl}如果你幫我找我正在找的樹木，那我就考慮看看。	나의 기술을 배우고 싶소?{nl}댁이 내가 찾는 나무를 구해 준다면 생각해 보리다.	플레쳐 마스터
QUEST_JOBSTEP_20150714_002709	最強獵人的境界…不知道你能不能消化得了。{nl}給你一項任務。任務是尋找各種怪物並將之獵殺。	가장 강한 헌터의 경지.. 당신이 그걸 소화해낼 수 있을지는 모르겠네요.{nl}과제를 드리죠. 여러가지 몬스터를 찾아 사냥하는 거예요.	QUEST_JOBSTEP_20150323_002259	雖然你說要接受我的指導，但我也不知道你能消化多少啊！{nl}這是我出的課題。請找到這些怪物並消滅牠們吧！	당신이 저에게 가르침을 받겠다고 해서 그걸 소화해낼 수 있을지는 모르겠네요.{nl}과제를 드리죠. 여러가지 몬스터를 찾아 사냥하는 거예요.	헌터 마스터
QUEST_JOBSTEP_20150714_002710	目標是破旗森林的魔力鴨、魔法師之塔5層的暗黑德雷克、祈願森林的柯瓦。{nl}尋找怪物應該也不容易。	해진깃발숲의 더키, 마법사의 탑 5층의 검은 드레이크, 기원의 숲의 코왁입니다.{nl}몬스터들을 찾는 것도 쉽진 않을 거에요.	QUEST_JOBSTEP_20150323_002260	卡汀森林入口的野蜘蛛、 貓頭鷹之墓的艾洛瑪庫、波塞林奇斯森林的綠色獠牙豬。{nl}當然我會給你怪物誘餌。	카틴 숲 입구의 크루마보, 매너클 묘지의 엘로마고, 포슬린키스 숲의 초록 포쿠본입니다.{nl}물론, 미끼 정도는 드리지요.	헌터 마스터
QUEST_JOBSTEP_20150714_002711	如果你想成為更強的巫蠱師，我有項任務要交給你。{nl}那就是向史可尼斯原野的大黃蜂把特別的毒收集回來。	더 강한 무고사가 되겠다면 네게 줄 과제가 있어.{nl}사크니스 벌판의 바이트에게서 특별한 독을 모아오는 거야.	QUEST_JOBSTEP_20150323_002261	如果你想成為更強的巫蠱師，我有項任務要交給你。{nl}那就是向史可尼斯原野的大黃蜂把特別的毒收集回來。	네가 무고사로서 더 높은 경지를 꿈꾼다면 네게 줄 과제가 있어.{nl}사크니스 벌판의 바이트에게서 특별한 독을 모아오는 거야.	무고사 서브 마스터
QUEST_JOBSTEP_20150714_002712	毒所具有的魅力是很難擺脫的。我也是其中一人。{nl}來，那麼要重新開始嗎？	독이 가진 매력은 헤어나기 힘들지. 나도 그런 사람 중의 하나야.{nl}자. 그럼 다시 시작해 볼까?	QUEST_JOBSTEP_20150317_000394	毒所擁有的魅力讓人很難擺脫，我也是沉迷者之一。{nl}你也會了解那個魅力的，從今天慢慢開始吧！	독이 가진 매력은 헤어나기 힘들지. 나도 그런 사람 중의 하나야.{nl}너도 그 매력을 알게 해줄게. 오늘부터 천천히 시작해 보자고.	무고사 서브 마스터
QUEST_JOBSTEP_20150714_002713	獵殺都躲起來的怪物就是你的任務。{nl}位置是在亞希梅斯堤交叉路。{nl}如果想成為更強的斥候，這點事你必須能辦到。不是嗎？	몰래 숨어있는 몬스터를 사냥하는 게 네 과제야.{nl}위치는 압시메스티 교차로. {nl}더 강한 스카우트가 되고 싶다면 이 정도는 해 내야지. 안 그래?	QUEST_JOBSTEP_20150323_002263	狩獵那些偷偷躲起來的怪物就是我的任務。{nl}位置就在史可尼斯原野。{nl}如果你想成為斥候就必須完成這個任務。你說是吧？	몰래 숨어있는 몬스터를 사냥하는 게 네 과제야.{nl}위치는 사크니스 벌판. {nl}스카우터를 지망한다면 이 정도는 해 내야지. 안 그래?	스카우트 마스터
QUEST_JOBSTEP_20150714_002714	沒想到你兩三下就完成了耶？{nl}很好。要馬上進入更深的階段嗎？{nl}	생각보다 쉽게 해냈네?{nl}좋아. 이제 심화단계로 들어가 볼까?{nl}	QUEST_JOBSTEP_20150317_000397	比想像中還容易完成耶？{nl}好。教人應該很有趣。如果之後你還想要學習就來找我。{nl}	생각보다 쉽게 해냈네?{nl}좋아. 가르치는 재미가 있겠어. 앞으로도 배우고 싶은 게 있으면 날 찾아와.{nl}	스카우트 마스터
QUEST_JOBSTEP_20150714_002715	流氓的行動要快。{nl}在卡汀森林入口的練習場利用煙幕彈來對付怪物。{nl}那裡也有很強的怪物，你最好小心一點。	로그란 우선 발이 빨라야해.{nl}카틴 숲 입구에 준비된 연습장에서 연막탄을 이용해 몬스터를 상대해봐.{nl}꽤 강한 녀석도 있으니까 긴장하는 게 좋을거야.	QUEST_JOBSTEP_20150511_002597	如果想和我學點什麼，首先腳步必須要快。{nl}在卡汀森林入口所準備好的練習場上使用煙幕彈消滅怪物看看吧。{nl}因為有很強的傢伙，所以最好不要掉以輕心。	내게 뭐라도 배우려면 우선 발이 빨라야해.{nl}카틴 숲 입구에 준비된 연습장에서 연막탄을 이용해 몬스터를 처치해봐.{nl}꽤 강한 녀석도 있으니까 긴장하는 게 좋을거야.	로그 마스터
QUEST_JOBSTEP_20150714_002716	神出鬼沒是流氓的拿手絕活。{nl}就是像華麗的花般利用快速的動作讓敵人眼花撩亂。	신출귀몰함은 로그의 꽃이지. {nl}아주 화려한 꽃처럼 빠른 몸놀림으로 정신을 쏙 빼놓는 거야.	QUEST_JOBSTEP_20150317_000403	神出鬼沒是流氓的拿手絕活。{nl}就是像華麗的花般利用快速的動作讓敵人眼花撩亂。	신출귀몰함은 로그의 꽃이지. {nl}아주 화려한 꽃처럼 빠른 몸놀림으로 정신을 쏙 빼놓는 거야. 	로그 마스터
QUEST_JOBSTEP_20150714_002717	重裝步兵最完美的境界就是破壞一切。{nl}遺憾的是，我的熟人刀騎兵大師不相信有這種事。{nl}	하플라이트의 가장 완벽한 경지는 모든 것을 다 뚫어버리지요.{nl}안타깝게도 제 지인인 하카펠 마스터는 그런 건 없다고 믿고 있습니다만..{nl}	QUEST_JOBSTEP_20150323_002265	你說想跟我學習。{nl}	제게 가르침을 받고 싶으시다고요. {nl}	하플라이트 서브 마스터
QUEST_JOBSTEP_20150714_002718	所以如果你代替我出馬，也許他就能有所領悟。{nl}你覺得如何？	그러니 제가 아니라 당신이 나서 주시면 그 친구도 깨닫는 게 있을 겁니다.{nl}어떻습니까?	QUEST_JOBSTEP_20150323_002266	那麼代替和刀騎兵大師的打賭，希望你能幫我。{nl}那個朋友相信有東西是無法貫穿的。{nl}	그렇다면 하카펠 마스터와의 내기를 대신 해 주셨으면 하는데요.{nl}그 친구는 뚫을 수 없는 것이 존재한다고 믿고 있거든요.{nl}	하플라이트 서브 마스터
QUEST_JOBSTEP_20150714_002719	槍是無敵不敗的武器。{nl}在鬼影凱伊洛死掉之後，我好想見那可憐的朋友一面。	창은 무적이고 불패입니다.{nl}섀도게일러가 죽고 난 뒤 그 불쌍한 친구의 얼굴을 보고 싶군요.	QUEST_JOBSTEP_20150317_000409	槍是無敵不敗的武器。{nl}在消滅鬼影凱伊洛之後，我好想見那可憐的朋友一面。	창은 무적이고 불패입니다.{nl}섀도게일러를 처치하고 난 뒤 그 불쌍한 친구의 얼굴을 보고 싶군요.	하플라이트 마스터
QUEST_JOBSTEP_20150714_002720	如果那位朋友問起，我會很自豪地說是我們有實力的重裝步兵打倒的。{nl}雖然你已經達到大師的境界，但如果覺得有不足之處就來找我。	그 친구가 묻거든 우리의 유능한 하플라이트가 쓰러뜨렸노라고 자랑하지요.{nl}당신은 이미 대가의 경지이지만 혹시나 부족한 것이 있으면 저를 찾아 주시길.	QUEST_JOBSTEP_20150323_002267	如果那個朋友友問起的話，我會驕傲的說是我們實力重裝步兵擊倒的。{nl}那麼就以這個來認定你的實力吧！	그 친구가 묻거든 우리의 유능한 하플라이트가 쓰러뜨렸노라고 자랑하지요.{nl}이걸로 당신을 인정해 드리겠습니다.	하플라이트 서브 마스터
QUEST_JOBSTEP_20150714_002721	你想成為最強的野蠻人啊。{nl}有件事要你去做。{nl}	최고의 바바리안을 원하는군.{nl}네가 해야 할 일이 있다.{nl}	QUEST_JOBSTEP_20150317_000411	你想跟我學習嗎？{nl}那麼得進行一項試驗。{nl}	나에게 가르침을 받고 싶은가.{nl}그렇다면 한 가지 시험을 치뤄야 한다.{nl}	바바리안 마스터
QUEST_JOBSTEP_20150714_002722	聽說其他大師為了消滅貓頭鷹之墓的耶庫已經派出門徒了。{nl}但那必須由你來了結。你去一趟吧	다른 마스터들이 매너클 묘지의 예쿱을 없애기 위해 제자들을 보냈다고 한다.{nl}하지만 그건 네가 끝내야 하는 일이다. 다녀와라.	QUEST_JOBSTEP_20150323_002268	其他大師為了消滅貓頭鷹之墓的耶庫派了各門下徒弟前往消滅。{nl}但是那應該是你要了結的任務。快去快回吧！	다른 마스터들이 매너클 묘지의 예쿱을 처치하기 위해 제자들을 보냈다고 한다.{nl}하지만 그건 네가 끝내야 하는 일이다. 다녀와라.	바바리안 마스터
QUEST_JOBSTEP_20150714_002723	對最強的野蠻來說，耶庫只不過是小菜一碟。	최고의 바바리안에게 예쿱 정도는 쉬울 것이다.	QUEST_JOBSTEP_20150317_000413	如果你有資格接受我的教導，那麼耶庫對你來說是很容易的事。	내 가르침을 받을 자격이 있다면 예쿱 정도는 쉬울 것이다.	바바리안 마스터
QUEST_JOBSTEP_20150714_002724	前往克林卡的莊園就能看到曼陀花獸。{nl}必須有能力對付牠才有資格成為百夫長。	그린가의 장원에 가면 콜리멘시아를 만날 수 있다.{nl}그 정도는 상대할 실력은 되어야 센츄리온의 자격이 있겠지.	QUEST_JOBSTEP_20150323_002270	到克林卡的莊園去的話，可以見到曼陀花獸。{nl}至少你得具有消滅曼陀花獸的能力才有成為百夫長的資格。	그린가의 장원에 가면 콜리멘시아를 만날 수 있다.{nl}그 정도는 처치할 실력은 되어야 센츄리온의 자격이 있겠지.	센츄리온 마스터
QUEST_JOBSTEP_20150714_002725	所謂的侍從雖然一個人也很強大，但與隊友並肩作戰時更能散發光芒。{nl}尤其是使用繩子與同伴一起進攻的連續攻擊可說是最為猛烈的。	스콰이어란 혼자서도 강하지만 파트너와 함께할 때 특히 더 빛이 나는 분야에요.{nl}특히 밧줄을 사용하여 동료와 함께 공격하는 연계 공격은 어떤 공격보다도 강력하죠.{nl}	QUEST_JOBSTEP_20150317_000418	雖然侍從一個人也很強，但是在幫助伙伴時更加發光發熱。{nl}特別是使用麻繩和同伴一起發動的連續攻擊比任何攻擊都還要強烈。{nl}	스콰이어란 혼자서도 강하지만 내 파트너를 도울 때 특히 더 빛이 나는 분야에요.{nl}특히 밧줄을 사용하여 동료와 함께 공격하는 연계 공격은 어떤 공격보다도 강력하죠.{nl}	스콰이어 마스터
QUEST_JOBSTEP_20150714_002726	這是捆索繩。{nl}請在波塞林奇斯森林練習，直到能用它一次捕捉3隻以上。{nl}有關侍從的事等你練成再說吧。{nl}{nl}	이건 포박 포승줄이에요.{nl}이걸로 포슬린키스 숲에서 한번에 세 마리 이상 잡아볼 수 있도록 연습해 오세요.{nl}스콰이어에 대해선 그 후에 말씀 나눠보도록 하죠.{nl}{nl}	QUEST_JOBSTEP_20150323_002271	這是捆索繩。{nl}帶著這個到大教堂至聖所，充分練習後再回來。{nl}我要教導你什麼，等你回來再分享。	이건 포박 포승줄이에요.{nl}이걸 가지고 포슬린키스 숲에 가서 충분히 다룰 수 있을 만큼 연습해 오세요.{nl}제 가르침에 대해선 그 후에 말씀 나눠보도록 하죠.	스콰이어 마스터
QUEST_JOBSTEP_20150714_002727	熟練了嗎？{nl}這就是侍從。從現在起一步步學習吧。	어느 정도 익숙해졌나요?{nl}스콰이어란 그런 것입니다. 지금부터 차근히 배워 보죠.	QUEST_JOBSTEP_20150317_000421	熟練到某種程度了嗎？{nl}我會依約定好好教導你的。	어느 정도 익숙해졌나요?{nl}약속대로 당신을 철저히 가르쳐 드리겠어요.	스콰이어 마스터
QUEST_JOBSTEP_20150714_002728	聽說貓頭鷹之墓有個名叫比特雷巨蜂的怪物正在大肆威脅人們。{nl}你怎麼想？ 希望你把它當成是向我學習最強技能的代價。	매너클 묘지에서 비테레지나라는 몬스터가 사람들을 마구 위협하고 있대.{nl}어떻게 생각해? 내 최고의 기술을 배우는 댓가라고 생각해 줬으면 좋겠는데.	QUEST_JOBSTEP_20150323_002272	據說貓頭鷹之墓那裏叫做比特雷巨蜂的怪物常常威脅的居民的生命安全。{nl}怎麼樣？就當成跟我學習技術的代價吧。	매너클 묘지에서 비테레지나라는 몬스터가 사람들을 마구 위협하고 있대.{nl}어떻게 생각해? 내 기술을 배우는 댓가라고 생각해 줬으면 좋겠는데.	새퍼 마스터
QUEST_JOBSTEP_20150714_002729	我身負大師之名，必須懂得幫助身邊的人，但老實說我真的抽不出時間。{nl}總之，你真的很了不起。但你要做好準備成為更強的工兵。	마스터의 이름을 달고 있다면 주변을 도울 줄 알아야 되는데 솔직히 짬이 안나.{nl}어쨌든 정말 굉장하군. 하지만 더 엄청난 새퍼가 될 준비를 하라고.	QUEST_JOBSTEP_20150323_002273	我身負大師之名，必須懂得幫助身邊的人，但老實說我真的抽不出時間。{nl}總之，我會依約定教你我的技術。	마스터의 이름을 달고 있다면 주변을 도울 줄 알아야 되는데 솔직히 짬이 안나.{nl}어쨌든 약속한 대로 네게 기술을 가르쳐 줄게.	새퍼 마스터
QUEST_JOBSTEP_20150714_002730	既然你都說到這份上了，我也不是沒有辦法。{nl}佩迪米安外城的莫厄把我的材料破壞殆盡，如果你狠狠教訓牠，我就把你的順序提前。	그렇게까지 말한다면 방법이 없는 건 아니오.{nl}내 재료들을 다 박살낸 페디미안 외곽의 모아를 흠씬 두들겨준다면 순서를 앞당겨 드리지.	QUEST_JOBSTEP_20150323_002274	既然你都說到這份上了，我也不是沒有辦法。{nl}佩迪米安外城的莫厄把我的材料破壞殆盡，如果你好好處理掉牠，我就把你的順序提前。	그렇게까지 말한다면 방법이 없는 건 아니오.{nl}내 재료들을 다 박살낸 페디미안 외곽의 모아를 처치해 준다면 순서를 앞당겨 드리지.	플레쳐 마스터
QUEST_JOBSTEP_20150714_002731	這個閃光彈給你。{nl}應該能更輕鬆地找出躲藏的怪物。	이 섬광탄을 줄게. {nl}숨어있는 몬스터들을 좀 더 쉽게 찾을 수 있을 거야.	QUEST_JOBSTEP_20150317_000432	因為你是初心者，所以我會給你閃光彈。{nl}可以更容易找到隱藏的怪物。	초심자니까 이 섬광탄을 줄게. {nl}숨어있는 몬스터들을 좀 더 쉽게 찾을 수 있을 거야.	스카우트 마스터
QUEST_JOBSTEP_20150714_002732	我在等你呢。我早就料想到你會自己來找我。{nl}想必你已經具備足夠的能力才來的吧？ {nl}	기다리고 있었어. 슬슬 날 찾아 올 거라고 생각했지.{nl}하지만 그럴 만한 실력이 되니까 찾아온 거겠지? {nl}	QUEST_JOBSTEP_20150317_000434	你應該是有學習的實力，才會來找我吧？{nl}比方說你和我對決然後獲勝。	내게 뭔가를 배울 만한 실력이 있으니까 찾아온거겠지?{nl}가령 나랑 대련해서 이긴다던가.	로그 마스터
QUEST_JOBSTEP_20150714_002733	比方說在對決中戰勝我。	가령 나와 대련해서 이긴다던가.				로그 마스터
