QUEST_20150714_002171	我現在很忙，我們最好還是下次再做吧。
QUEST_20150714_002172	啊，亞特利尤斯裡送來的人啊。{nl}下訂的稀釋液在這了。來，帶走時請小心不要打破了。
QUEST_20150714_002173	一罐稀釋液就足夠了。
QUEST_20150714_002174	厚安的碑文
QUEST_20150714_002175	尚未完成一萬三千個的冑甲就長眠於此，{nl}希望可以在女神的身邊完成。
QUEST_20150714_002176	腦袋傳來小小的呢喃聲。
QUEST_20150714_002177	請將我給你的裝置設置在水晶礦山2礦區內。
QUEST_20150714_002178	是貝雅山谷的史達布拉斯休憩地。{nl}如果還活著的話就好了。
QUEST_20150714_002179	柯拉佩達市長
QUEST_20150714_002180	請將稻草人帶來給我，我要來慰勞靈魂們。
QUEST_20150714_002181	含有我權能的水晶所噴出的氣息會讓怪物們感受到威脅並進行攻擊。{nl}
QUEST_20150714_002182	我的權能自水晶內流淌出來，請守護水晶讓它得以在史爾特凱拉森林內延展。
QUEST_20150714_002183	大哥連這個都準備好了，真的是了不起的人啊。
QUEST_20150714_002184	感受到靈魂們的憤怒。
QUEST_20150714_002185	香爐
QUEST_20150714_002186	香爐的香慢慢散開中。
QUEST_20150714_002187	感受到靈魂們的冤枉。
QUEST_20150714_002188	感受到靈魂們的痛苦。
QUEST_20150714_002189	感受到靈魂們的悲憤。
QUEST_20150714_002190	還沒有完成封印嗎？{nl}因為除了啟示者外沒有其他可以依賴的人，真的非常痛苦。
QUEST_20150714_002191	已經替七彩谷居民靈魂們解開冤屈了嗎？
QUEST_20150714_002192	點火基礎
QUEST_20150714_002193	點火會因為做為媒介的元素不同而有所差異，但仰賴女神的恩寵，也可能會有無視差異的請況發生。{nl}為了這個，似乎必須努力達到高學問成就與對女神的信仰意志的平衡。
QUEST_20150714_002194	1.乾燥的環境{nl}2. 易燃物的存在{nl}3. 足夠的魔力{nl}4. 女神的恩寵
QUEST_20150714_002195	弗羅里… 爆發出光芒，變成一小搓灰燼之後就消失了。{nl}那魔族到底做了什麼事情? {nl}身為見習魔法師的我沒有辦法知道。{nl}
QUEST_20150714_002196	[小心輕放]{nl}-實驗最後的階段。拿取時請務必小心-
QUEST_20150714_002197	1. 在石化探測器樣本裡，請不要讓希爾特結晶體有過度反應nl}2. 不要讓希爾特增幅機長時間運作。{nl}3. 透過希爾特增幅機，也只是暫時性讓石化綿延，請不要在隔離實驗室內待太久。
QUEST_20150714_002198	[使用限制]{nl}-隔離實驗室因為最近的事件而被封鎖，{nl}獲得團長許可者方可以透過傳點進出。-
QUEST_20150714_002199	[使用方法]{nl}1. 請將獲得的希爾特結晶使用於傳點動力機上。{nl}2. 必須使用一定的數量後，才能讓一個人進去。{nl}3 如欲讓多數人員進出的情況，請向團長詢問。
QUEST_20150714_002200	石化進行中
QUEST_20150714_002201	身體變僵硬。
QUEST_20150714_002202	動作變輕盈。
QUEST_20150714_002203	在等待啟示者的這段期間，無論如何我都阻礙了他們。{nl}但正如你所看到的，這樣的身體已經到達了極限。
QUEST_20150714_002204	我已經收到你的信了。{nl}在勒肯過世後的現在正是女神賜予的機會，{nl}失去當家者的勒肯家子孫們願意相信你真是太好了。{nl}
QUEST_20150714_002205	這權力證書我變更為你的名字，剩下的文件也都寄給你，{nl}他的遺書或土地文件我會負責擔保。{nl}訂金就用上次的方式支付！{nl}
QUEST_20150714_002206	勒肯的名字連一個都不能讓他們活著，就連下人也是，{nl}被稱為護衛大師的勒肯女兒也一定要處理掉。
QUEST_20150714_002207	可疑的男子
QUEST_20150714_002208	看了一下，身體的行動上似乎沒有什麼太大問題。{nl}你真的差點有大麻煩了。
QUEST_20150714_002209	啊！我叫做旻茲，目前率領著獵人們。{nl}如果可以的話，在我位於投波拉十字路口的營區內稍微聊一下吧。
QUEST_20150714_002210	就現在來說，似乎沒有能幫助病人的方法。
QUEST_20150714_002211	有吃過解毒劑了嗎？
QUEST_20150714_002212	如果已說服資深修道士，請前往皮提斯森林。
QUEST_20150714_002213	謝謝！{nl}我都不知道背包被莿棘纏住扯破了，還急忙逃跑…
QUEST_20150714_002214	我們是從拉烏基美濕地逃來這裡的，{nl}假如在耶魯薛可小路到投波拉十字路口之間發現散落的文件，請帶來給我們。
QUEST_20150714_002215	不管怎樣不行的事情就是不行，{nl}在搶回修道院、救出院長之前，都不要再提到驅逐的事情了。
QUEST_20150714_002216	什麼？ 要和獵人一起行動？{nl}我不太喜歡。馬勒扣既然都這樣說了，那也沒有辦法… 我了解了。
QUEST_20150714_002217	要和獵人一起搶回修道院？{nl}雖然是好消息，但馬勒扣會改變心意嗎？
QUEST_20150714_002218	就算不這樣，我也在擔心祈禱室內的修道院院長，真是太好了。{nl}雖然不知道獵人們是不是值得信賴…
QUEST_20150714_002219	真的不知道這樣有沒有關係，{nl}被外人指揮的感覺… 馬勒扣是位賢明的人，應該要相信他吧。
QUEST_20150714_002220	不管怎樣，我們都遵照馬勒扣的命令。{nl}可以有堅強的支援軍真的太好了。
QUEST_20150714_002221	不管怎樣，盡快搶回修道院是最重要的，{nl}而且修道院長的安危不就是那麼重要的事情嗎。
QUEST_20150714_002222	無名的遊子。無名已被毒給吞噬，{nl}現在可以不用繼續旅行，在女神的懷抱中好好休息。{nl}
QUEST_20150714_002223	將周邊的人事物擺在第一順位的農夫比波藍。{nl}在此長眠。
QUEST_20150714_002224	我現在就回到我那麼想念的你懷裡。{nl}和你的箭一起。和你的短劍一起。西阿納卡。
QUEST_20150714_002225	出生於佩迪米安的年輕裁縫師高丹。{nl}長眠於提達修道院。{nl}
QUEST_20150714_002226	全能的女神啊。{nl}我最後終於獲得自由。{nl}-佃農提拉
QUEST_20150714_002227	謝謝。{nl}如果能替我們減少了數字，對生命的威脅就會減少的樣子。
QUEST_20150714_002228	謝謝。{nl}如果你看到有水的地方冒出氣泡的話，就是有多刺荸薺的意思。{nl}請把它的根帶來給我吧。
QUEST_20150714_002229	真的嗎？{nl}如果你肯幫忙的話，我會給你我所能做的。
QUEST_20150714_002230	殿堂已經保住了。{nl}繼續走吧！
QUEST_20150714_002231	快點救救院長！
QUEST_20150714_002232	終於到了搶回修道院的時候了。
QUEST_20150714_002233	我和啟示者一起去，{nl}好好做吧。
QUEST_20150714_002234	下個走廊開始就用跑的，{nl}雖然是很吃力的狀況，但應該剩不了多少了。
QUEST_20150714_002235	我在這邊阻擋蜂擁而至怪物們，{nl}啟示者和寇斯先上去。
QUEST_20150714_002236	謝謝。{nl}剛剛已經看到修道士慕夏尼弟兄進入修道院裡面了，{nl}重要道具的保管任務也有他，所以問他會比較清楚。
QUEST_20150714_002237	有勞你了，真是抱歉。{nl}箱子排列在內部接待室裡。
QUEST_20150714_002238	已經找到了啊。{nl}請把水晶球給我。
QUEST_20150714_002239	該死的！ 奮戰到底…{nl}你們兩個去追那傢伙，其他人過來幫我！
QUEST_20150714_002240	看著同伴的獵人
QUEST_20150714_002241	嘿…！ 振作！
QUEST_20150714_002242	謝謝您。我要做事情原本就多…{nl}應該要分類綠色標記，但剛好一本都沒看到。{nl}請在修道院室內的家具幫我找找。
QUEST_20150714_002243	這受到詛咒的都市能有什麼事。{nl}沒有特別事情的話，你請回吧。
QUEST_20150714_002244	你是啟示者嗎，{nl}我確實有聽過你的故事了。{nl}
QUEST_20150714_002245	就先讓你通過吧，{nl}因為剛好凱爾利斯騎士團裡再找有能力的人。
QUEST_20150714_002246	但，這地方的所有權限都是我們王國軍在負責。{nl}知道就好，我希望你好好表現。
QUEST_20150714_002247	你說什麼薩爾提斯托，這是什麼意思？{nl}太荒謬了…
QUEST_20150715_002248	柯拉佩達的賭徒{/}{nl}(AWagererofKlaipeda)
QUEST_20150715_002249	蒙德斯塔斯承認自己輸了，並承諾依約下次還債後拉著馬跟推車就要離開時，老鍊金術士帶著不明的微笑，提醒蒙德斯塔斯注意看向自己。{nl}
QUEST_20150717_002250	請輸入寵物的名字。
QUEST_20150717_002251	寵物可以在你的戰鬥中幫忙，{nl}也可以讓寵物在旁邊看著你戰鬥或是進行特定訓練。{nl}
QUEST_20150717_002252	如何？ 牠們這樣不就是你帥氣的同伴嗎？{nl}但是只有特定職業才能騎乘寵物，這點請務必留意。{nl}
QUEST_20150717_002253	雜貨商人
QUEST_20150717_002254	真抱歉我沒辦法親自出去應戰，{nl}但是我如果使用魔法的話，魔族們馬上就會查覺到了。
QUEST_20150717_002255	我從現在開始要矯正塔內扭曲的魔力，{nl}第一次不得不使用魔力，怪物們會蜂擁而至，請保護我。
QUEST_20150717_002256	加比婭務必要安然無事啊… 快點走。
QUEST_20150717_002257	我有不好的預感，這震動… {nl}我們先快點移動。
QUEST_20150717_002258	只要有紅焰寶石的話，加比婭就可以獲得更大的力量。
QUEST_20150717_002259	女神已經到極限了，{nl}不管怎要要快點給她紅焰寶石。
QUEST_20150717_002260	剛剛那個震動… 一點都不尋常。
QUEST_20150717_002261	快點前往魔力控制室，{nl}如果只是控制塔的魔力，我還可以辦得到。
QUEST_20150717_002262	已經接近魔力控制室了，真是太好了！{nl}快點走。
QUEST_20150717_002263	我的另一名弟子拉伊爾斯非常聰明，理解力和判斷力都非常優秀，非常渴望知識，我會擔心自己有沒有辦法指導他。{nl}身為一位求知若渴的學者，這當然是必須要具備的心態，但如果過多的話，就只會走上邪門歪道而已。{nl}
QUEST_20150717_002264	我的弟子之中有兩個人一直跟隨我直到晚年的現在，大概在我死後會繼承我的成果。{nl}
QUEST_20150717_002265	奇怪的碑石
QUEST_20150717_002266	{memoX}聚沙成塔，積少成多。
QUEST_20150717_002267	奇怪的石柱
QUEST_20150717_002268	加比婭等待的人還沒有到嗎…
QUEST_20150717_002269	[小心輕放]{nl}-實驗最後的階段。拿取時請務必小心。-{nl}
QUEST_20150717_002270	1. 在石化探測器樣本裡，請不要讓希爾特結晶體有過度反應nl}2. 不要讓希爾特增幅機長時間運作。{nl}3. 透過希爾特增幅機，也只是暫時性讓石化綿延，請不要在隔離實驗室內待太久。
QUEST_20150717_002271	[使用限制]{nl}-隔離實驗室因為最近的事件而被封鎖，{nl}獲得團長許可者方可以透過傳點進出。-
QUEST_20150717_002272	[使用方法]{nl}1. 請將獲得的希爾特結晶使用於傳點動力機上。{nl}2. 必須使用一定的數量後，才能讓一個人進去。{nl}3 如欲讓多數人員進出的情況，請向團長詢問。
QUEST_20150717_002273	這是火花的結晶凝結的地方，{nl}有可能會受到燒燙傷請務必注意。
QUEST_20150717_002274	
QUEST_20150717_002275	火的故事
QUEST_20150717_002276	我在塔內最高處的女神居所內看到了奇怪的景象，{nl}加比婭女神身邊的那隻鳥似乎因為女神的恩寵而全身被火包圍著。{nl}
QUEST_20150717_002277	安靜燃燒的火花 {nl}像是要將所有東西燃燒殆盡般的那對羽翼…{nl}能讓人有敬畏之心的迷人景象絕對不是這個世界的東西。{nl}
QUEST_20150729_002278	
QUEST_20150729_002279	
QUEST_20150729_002280	
QUEST_20150729_002281	{memoX}嗯… 還沒有全部募集到隊員的樣子？
QUEST_20150729_002282	{memoX}歡迎光臨，傭兵委託所。{nl}不過… 還沒有適合你的委託呢。{nl}
QUEST_20150729_002283	{memoX}之後再和值得相信的同伴們一起前來，那時候會給你合適的委託。{nl}前提是要有委託囉！{nl}
QUEST_20150729_002284	剛好有好的委託進來，{nl}要開始嗎?
QUEST_20150729_002285	話說真的很奇怪，{nl}如果是拉伊瑪女神的啟示的話，不是任何人都能夠去解開封印的。
QUEST_20150729_002286	這啟示到底是希望，還是新災難的開始，實在很難斷定..{nl}我們也在考慮要繼續調查。
QUEST_20150729_002287	)}我們兒子自願入伍，{nl}所以才會向最高女神奧施莉奈祈禱。{nl}
QUEST_20150729_002288	)}怪物日益增多喔，森林裡已經亂到無法讓人居住的地步。{nl}柯拉佩達還算安全。{nl}
QUEST_20150729_002289	我在想這或許是奧施莉奈女神在守護著我們也不一定，{nl}因為她是帶領所有女神的女神不是嗎？
QUEST_20150729_002290	)}雖然很慶幸我兒子想要成為士兵的夢想實現了…{nl}但怪物一直出現，所以很擔心他會不會受傷。
QUEST_20150729_002291	告訴他在水晶礦山內獲得的部分啟示內容。
QUEST_20150729_002292	過了晚上就會到早晨了吧？ 奧施莉奈女神就是帶領早晨的女神。{nl}不只如此，我們死去也會回到奧施莉奈女神的身邊。
QUEST_20150729_002293	{memoX}所謂永生…{nl}我使用奧施莉奈女神的權能，每當豎立一個貓頭鷹雕像時，壽命就會延長。{nl}只要這個老朽的身軀可以成為女神的力量並幫助這個世界的話，無論多久我都願意去做。
QUEST_20150729_002294	{memoX}你也對永生有興趣嗎？{nl}因為死靈魔法師掌管死者，所以也可以感受到生命力，根據實力可能會有所不同。{nl}像我這種實力的話，吸收他人生命力後，也可以用來延長壽命。
QUEST_20150729_002295	{memoX}看來你對於維持我永生的方法非常好奇的樣子！{nl}假如暫停時間也可以說是永遠的話就辦得到了，{nl}我透過暫停身體的時間來維持不會變老也不會死掉的狀態，{nl}就不知道像這樣暫時停止的事情能不能被視為是永遠了。
QUEST_20150729_002296	終端機如果不是特別的時間，是不能隨意觸摸的…我來替你解開詛咒。
QUEST_20150729_002297	聚沙成塔，積少成多。
QUEST_20150729_002298	柯拉佩達中央廣場的奧施莉奈女神像與賭徒蒙德斯塔斯之間交織著有趣的故事。{nl}
QUEST_20150729_002299	女神像雕刻完成時，沒有人知道那個女神像到底是在描繪誰，{nl}只有雕刻女神像的雕刻師和蒙德斯塔斯才知道。{nl}
QUEST_20150729_002300	很多人為了知道女神像是誰而和蒙德斯塔斯打賭，但是蒙德斯塔斯到死為止都沒有輸過。
QUEST_20150729_002301	以所有姻緣之名再次感謝。{nl}我從現在開始也會跟上你的步伐尋找奧施莉奈女神。{nl}
QUEST_20150729_002302	女神像說明
QUEST_20150729_002303	以主神奧施莉奈之權能，讓你移動至想去的地區。
QUEST_20150729_002304	教壇的聖物
QUEST_20150729_002305	{memoX}當人類的貪念跟傲慢達到巔峰時，神聖樹木從地下冒出來懲罰傲慢的人並奪走所有的東西。
QUEST_20150729_002306	破壞棺木
QUEST_20150729_002307	棺木已經被破壞！
QUEST_20150729_002308	打開棺木的話，屍體就會走出來！
QUEST_20150729_002309	因為被未知的力量阻擋而無法靠近。
QUEST_20150729_002310	阿依絲泰向年長的乞丐拜託道：{nl}[請問有撿到我掉在地上的銀幣嗎? 如果有的話，希望你可以還給我，那是我今天工作一整天賺到的錢，我非常需要那筆錢。]{nl}
QUEST_20150729_002311	{nl}年長的乞丐對阿依絲泰的話覺得無可奈何。{nl}竟然會有這種在佩迪米安尋找掉落銀幣的念頭，是非常不可思議的事情。{nl}年長的乞丐懶得向阿依絲泰說明，所以就這樣回答她：{nl}[我也在這附近掉了銀幣，結果沒找到，如果妳找的時候有順便找到我的就好了。]{nl}
QUEST_20150729_002312	[回到妳工作的地方，據實以告拜託看看如何？」{nl}，然後像是猶豫了一下接著說：{nl}「我會在這裡繼續找看看有沒有妳的銀幣。]{nl}{nl}
QUEST_20150729_002313	所以他這樣說：{nl}[就像把果園裡掉落的果實一個都不剩地撿起來一樣，妳也可以把掉在佩迪米安的錢再撿起來，我是絕對不會給妳兩次工錢的！」{nl}阿依絲泰因果園主人冷漠的話而淚眼汪汪。{nl}果園主人看到她這個樣子，雖然內心稍微遲疑了一下，但不想再把錢給她。{nl}
QUEST_20150729_002314	果園主人下定決心這樣說道：{nl}[如果妳真的需要銀幣的話，去向銀匠問看看有沒有殘渣可以拿吧！]{nl}{nl}
QUEST_20150729_002315	銀匠聽了阿依絲泰的話後回答：{nl}[就算年紀再小，也太愚蠢了！ 妳竟然不知道所有掉落在佩迪米安的地上的錢全部都會消失的事情嗎？]{nl}{nl}
QUEST_20150729_002316	阿依絲泰聽到這句話非常驚訝，對接下來銀匠的說明感到更加傷心。{nl}所以她開口問了：{nl}[為什麼會有這種事情發生？]{nl}{nl}
QUEST_20150729_002317	因為銀匠也不知道原因，就隨便把腦袋裡出現的想法說了出來：{nl}[大概是澤米娜女神帶走的吧。]{nl}{nl}
QUEST_20150729_002318	聽到這話的阿依絲泰說：{nl}[那只要向澤米娜女神拜託的話就可以了吧。]{nl}銀匠聽到這句話覺得很無言，只好說：{nl}[如果妳這樣想的話，就拜託她把我之前掉在地上的銀手工製品也一起還來吧！]{nl}{nl}
QUEST_20150729_002319	阿依絲泰雖然覺得疲憊，但還是前去祈求澤米娜女神像。{nl}趴在澤米娜女神像前的阿依絲泰向女神懇切地祈禱：{nl}[拜託！請把我遺失的銀幣還給我。] {nl}就這樣祈禱的同時，阿依絲泰此時再也忍不住掉下了眼淚。{nl}
QUEST_20150729_002320	不知道哭了多久、祈禱了多久？{nl}阿依絲泰突然聽到回應自己的聲音。{nl}[我的孩子啊！ 妳想要找回自己的東西嗎？]{nl}{nl}
QUEST_20150729_002321	女神的聲音再次傳來：{nl}[阿依絲泰，現在你希望我做的事情並不是我喜歡的方式，我治理的大地是不會把穀食和水果賞給不努力的農夫。」{nl}{nl}
QUEST_20150729_002322	[但是我今天很努力地工作了。]{nl}
QUEST_20150729_002323	[我知道，所以會給妳還有妳的鄰居們機會，看看妳的腳下。]{nl}{nl}
QUEST_20150729_002324	走了幾步的阿依絲泰想到了銀匠大叔，{nl}所以再次前往他的家並敲了門。{nl}之後銀匠大叔就像在等著她一樣，一出來就馬上說：{nl}[對不起！ 我很後悔就這樣送走了妳，我給妳幾個銀幣吧！ 這次千萬不要再掉下去了，小心地回家啊！]{nl}{nl}
QUEST_20150729_002325	說話的同時，銀匠大叔拿出銀幣。阿依絲泰搖了搖頭說道：{nl}[不是這樣，女神已經還給我一個銀幣了，而且還給得更多。所以我想到大叔之前有說過你也曾遺失了銀，所以想把剩下的拿給你才來的。我現在不需要你給我的銀幣。]{nl}{nl}
QUEST_20150729_002326	銀匠對於她提到女神歸還銀幣的事情感到半信半疑，但當阿依絲泰拿出銀幣時才真正嚇了一跳。銀匠想了想後這樣說：{nl}[那麼就這樣吧，我收下妳想給我的，我要給妳的妳也就收下！ 如何？ 這樣很公平吧？ 我另外再給妳一個可以裝得下這些多出來銀幣的袋子。]{nl}
QUEST_20150729_002327	和銀匠大叔告別後的返家途中，阿依絲泰突然擔心起乞丐大叔是不是還在幫忙找自己的錢。{nl}阿伊泰絲在前往找乞丐大叔的途中遇見了果園主人． {nl}果園主人發現了阿依絲泰後非常開心地說：{nl}[我正在找妳呢！ 事實上剛剛這樣讓妳走掉，我深感抱歉…。為了向妳道歉，我會再給妳一次工錢。這次要小心，千萬不要再弄丟了。]{nl}{nl}
QUEST_20150729_002328	而且，果園主人還想給她比原本還要更多的銀幣。{nl}但是阿依絲泰搖搖頭說：{nl}[澤米娜女神已經把我的錢還給我了，而且銀匠大叔也有幫忙，現在的銀幣已經很多了。所以很謝謝您，但我真的不需要。來，請看。]{nl}{nl}
QUEST_20150729_002329	正當阿依絲泰因為銀幣增加而說不出話來的時候，果園主人這樣說了：{nl}[不管怎樣，如果不把這些給妳，我良心過意不去，妳一定要收下。] {nl}{nl}果園主人語畢，不讓阿伊絲泰有回話的空檔，像是強迫般把錢丟進打開的銀幣袋子內後就走掉了。{nl}等到阿依絲泰回神時，果園主人已經走遠，也無法叫住他了。{nl}
QUEST_20150729_002330	暫時停下腳步的阿依絲泰繼續往乞丐大叔的方向移動。{nl}當阿依絲泰快到遇見乞丐大叔的地方時，乞丐先發現了阿依絲泰，並連忙向她跑來，讓她看看自己手裡緊緊抓著的銀幣並說道：{nl}[妳看！ 我找到妳的銀幣了。]{nl}{nl}
QUEST_20150729_002331	阿依絲泰收好乞丐的銀幣後，把自己裝滿銀幣的袋子拿給乞丐說：{nl}[這個是為了答謝你幫我找到銀幣的謝禮，也是澤米娜女神賞賜的恩惠。]{nl}{nl}語畢，她在乞丐大叔還來不及說任何話之前就迅速離開了。{nl}{nl}
QUEST_20150729_002332	蒙德斯塔斯詢問老太婆帶著金塊要做什麼，{nl}於是老太婆答道：{nl}[只要讓這兩個金塊結婚的話，就會生出小金塊，我應該就可以成為有錢人。但這兩個金塊好像對彼此不滿意，我正在煩惱事情辦不成。]{nl}蒙德斯塔斯聽到這些話覺得很荒唐，於是說：{nl}[不對啊！如果想靠著金塊變成有錢人的話，應該是把金塊拿來當作資金去做些生意或是找個好地方投資，讓這兩個金塊結婚生小孩的事情是天方夜譚吧？]{nl}
QUEST_20150729_002333	聽到這話的老太婆氣呼呼地回答：{nl}[為什麼不行？ 事情成功的話，這就是最好的方法啊！ 是最安全最確實的。]{nl}「與其在這邊想這種不切實際的事情，還不如像我一樣去賭看看還好多了呢。」{nl}蒙德斯塔斯說了這些話後，老太婆更生氣了。
QUEST_20150729_002334	這然後說了：{nl}[所以你現在是覺得我的方法比你打賭那檔事還糟嗎？]{nl}[這是當然的，不是嗎？ 雖然打賭有輸有贏，但用奶奶的方法是絕對不會讓金塊更多的。」{nl}蒙德斯塔斯那樣回答後，老太婆稍微思考了一下回說：{nl}「那你要不要和我打個賭？」{nl}
QUEST_20150729_002335	蒙德斯塔斯瞬間回想起老太婆那不尋常的氣息而感到有點害怕，但有打賭這樣的誘惑，蒙德斯塔斯是絕對不會拒絕的，於是就這樣問了：{nl}[賭什麼呢？]{nl}[就是用你的方法和我的方法看看誰可以增加金塊。]{nl}[但打賭也有輸的時候吧？]{nl}
QUEST_20150729_002336	[不用擔心那個，打賭本來就是有輸有贏的東西，我也無法改變它，但是可以幫你固定順序。]{nl}「蛤？ 這是什麼意思？]{nl}[如果你同意和我打賭的話，那往後無論你和誰打什麼賭，從現在開始你一定會贏一次後輸一次。]{nl}[打賭的時候本來就經常發生一次贏一次輸的事情。]{nl}
QUEST_20150729_002337	蒙德斯塔斯這樣說，老太婆搖搖頭並追加說明。{nl}[我的話是從這裡離開之後，第一次的打賭不管你有多麼不合理都會贏的意思。然後再下次打賭，也就是第二次打賭時，不管多麼合理都一定會輸。]{nl}
QUEST_20150729_002338	蒙德斯塔斯對於這話有點懷疑，所以又問了：{nl}[意思是說從現在開始我單數次打賭無條件會贏，雙數次打賭無條件一定會輸的意思嗎？]{nl}[是的，就是這樣，你要做的事情就是在單數次打賭的時候賭多一點錢，再下次打賭的時候賭少一點錢而已。像這樣經過幾次的話，你就足以賺到跟金塊一樣的錢了，不是嗎？ 如何？ 要在這樣的條件下跟我賭賭看嗎？]{nl}[這樣輪流一贏一輸的能力會維持多久呢？]{nl}
QUEST_20150729_002339	老太婆用手指頭摸摸下巴，稍微猶豫並思考後回答：{nl}[各三次的話應該就夠了吧？ 所以當你完成第五次打賭的時候，要記得回來找我，當然最後第六次會輸掉的那場打賭也要進行才可以。如果不完成的話，我就無條件贏了。]{nl}
QUEST_20150729_002340	蒙德斯塔斯用有點顫抖的聲音詢問：{nl}[那要賺多少才行？]{nl}老太婆答道：{nl}「我先給你一個金塊，在回到我身邊之前，要再帶另外一個金塊回來，無論我的金塊有沒有生小金塊都算你贏。時間嘛…嗯… 我看看…大概一週就很夠了吧！]{nl}蒙德斯塔斯最後又再問了一件事情： {nl}[如果和妳打賭我輸了的話，要付出什麼樣的代價？]{nl}
QUEST_20150729_002341	老太婆回答：{nl}[那樣的話…]{nl}{nl}老太婆賣關子地停頓了一下才接著說：{nl}[先說你贏了的話，我就把金塊給你。還有給你的輪番一贏一輸的魔力也會一輩子帶著。但是如果你輸的話…]{nl}[輸的話呢？]{nl}蒙德斯塔斯緊張地問。{nl}
