QUEST_20170420_005899	喔，尤斯堤那 勒肯，那個家門的最後一個子女，必須同時負起家門與侍從大師的沉重責任，令人不捨的命運的主人阿…	오, 유스티나 르귄, 가문의 마지막 남은 자여, 가문과 스콰이어 마스터의 두 가지 길을 모두 책임져야 할 무거운 짐을 진 안타까운 운명의 소유자여….				소녀
QUEST_20170420_005900	索勒夏河頓本就是會成為頂尖擊劍手大師的貴族之後。{nl} 要是有誰想阻擋這個女孩的路，那是打算對抗命運的刀刃嘛。	소르샤 허턴은 최고의 펜서 마스터가 될 운명을 걷는 귀족가의 당찬 영애입니다.{nl} 이 아가씨의 앞날을 막는자는 운명의 칼날에 대항하려 하는 것입니다.				소녀
QUEST_20170420_005901	聖殿騎士大師 烏斯卡出身微寒，只是個平民的兒子，卻做到了同時兼任夏奧雷騎士團長和聖殿騎士大師之偉業。{nl} 他的謙遜同時顯現於他的外貌與心性等方面，他的責任感也與他的能力一樣可靠。	템플러 마스터 우스카는 한미한 평민의 아들로 태어나 왕국의 장군과 샤울레이 기사단장과 템플러 마스터를 겸직하는 위업을 달성하였습니다.{nl} 그의 겸손은 외모와 심성 등 모든 곳에서 빛나며, 그의 책임감은 그의 능력만큼이나 듬직한 사나이입니다.				소녀
QUEST_20170420_005902	希米爾家門的未來全倚靠家門代表龍騎士﻿大師 巴雷斯卡希米爾來決定。{nl} 雖然以他們的出奇不意，夏班史達會不會重新成為主人還不一定，但不管是什麼決定，都會是歷史性的選擇。	히밀 가문의 대표자인 드라군 마스터 발레스카 히밀에 의해 장차 히밀 가문의 진로가 결정될 것입니다.{nl} 그들이 지닌 창의 주인이 다시 샤펜스타가 될지 안 될지 모르지만, 어느 쪽이든 역사적 선택이 될 것은 틀림없습니다.				소녀
QUEST_20170420_005903	忍者大師 尤拉 斯瓦約內總是藏身於王國御座下暗不見光的地方，擋下任何威脅王座的勢力，是王國看不見的武器。	시노비 마스터 유라 스와요네는 왕국의 옥좌 아래 빛이 닿지 않는 곳에 숨은 채, 왕좌를 위협하는 모든 세력을 막아내는 보이지 않는 왕국의 무기입니다.				소녀
QUEST_20170420_005904	角鬥士大師 佩爾立克西亞的生活每一分秒都賭上生命，過著走在刀刃上的人生。{nl} 且她所留的每一滴汗，都是為了不讓命運的盡頭追上他，而付出的血債。	무르밀로 마스터 펠릭시아의 삶은 순간 순간이 생명을 걸고 칼날 위를 걷는 인생입니다.{nl} 또한 그녀가 흘리는 땀 한 방울은 종말의 운명이 그녀를 따라잡지 못하게 만들기 위해 지불하는 핏값입니다.				소녀
QUEST_20170420_005905	諾歐 帕雷塞烏斯，偉大的王的後孫！即使俗世的王為不屬於他，他自會以他的能力得到戰爭之王的稱號。	노어 파레세우스, 위대한 왕의 후손된 자여! 비록 속세의 왕좌는 그대의 것이 아니나, 전쟁의 왕이란 호칭은 그대의 랜스를 통해 얻게 되리라.				소녀
QUEST_20170420_005906	百夫長大師 克拉伊切是所有王國軍士兵們的楷模。{nl} 只是王國軍現在的狀況反而扯住他的後腿。	센츄리온 마스터 크라이첵은 모든 왕국군 사병들의 귀감입니다.{nl} 다만 왕국군의 현재 상태가 그의 발걸음을 묶고 있습니다.				소녀
QUEST_20170420_005907	我尊重鬥牛士大師克里戴拉歐泰羅的人生觀。{nl} 但是因為她所擁有的能力和影響力對世上可能造成負作用而覺得悲傷。	저는 마타도르 마스터 크리델라 오테로의 인생관을 존중합니다.{nl} 다만 그녀가 지닌 능력과 영향력이 세상에 그릇되게 작용할 수도 있다는 점 때문에 슬픕니다.				소녀
QUEST_20170420_005908	法師大師本來是所有魔法大師中才能最不足的。{nl} 但是現在她的實力比起任何一個有才能的大師都不遜色。{nl} 我不禁對她孤單的努力起了敬意。	위저드 마스터는 모든 마법 마스터 중에 가장 재능이 부족하였습니다.{nl} 그러나 지금 그녀의 실력은 그 어떤 재능있던 마스터에게도 뒤지지 않습니다.{nl} 저는 그 고단했던 노력에 경의를 표합니다.				소녀
QUEST_20170420_005909	阿布雷 梅林在聖職者與魔法師的兩者間找到新的平衡，對他的見識我感到很佩服。{nl} 若不是她，還有誰適合烈焰術士大師呢？	성직자와 마법사의 두 가지 운명 가운데 새로운 접점을 찾아낸 아브레 멜린의 식견에 저는 탄복하고 있습니다.{nl} 그녀가 아니라면 누가 파이로맨서 마스터에 어울리겠습니까?				소녀
QUEST_20170420_005910	寒冰法師大師 艾利斯托 克羅烏利如蛇一般，有智慧且雖知道怎麼遵從神意，卻不像鴿子一般純潔，欺瞞他人毫不猶豫的魔法師大家，我對他想說的就是這些了。	크리오맨서 마스터 알리스터 크로울리, 뱀처럽 지혜롭기에 신의는 지킬 즐 알지만, 비둘기처럼 순결하지는 않아 타인을 기만하는 일도 주저하지 않는 마법의 대가, 제가 그에 대해서 할 말은 그것이 다입니다.				소녀
QUEST_20170420_005911	伊立 泰利德念力法師大師是個將希望自己的才能能被認證的懦弱內心藏起來的男人。{nl} 他在學習魔法前就已經是超能力者，在他發現自己的超能力之前也就已經是個成功的大商人了。	일리 테리드 사이코키노 마스터는 자신의 천재성을 인정받고 싶어하는 여린 마음이 숨어있는 남자입니다.{nl} 그는 마법을 익히기 전에도 초능력자였고, 초능력이 발현되기 전에도 성공한 대상인이었는데도 그렇습니다.				소녀
QUEST_20170420_005912	鎖鏈法師大師 維諾那 安德是在眾多天才中，即使在魔法學歷史上也很罕見的天才。{nl} 少說也要170後，出現像是魯希德 萬托斯芬或者歐文狄爾班等魔法師，才有可能超越。	링커 마스터 위노나 엔데는 숱한 천재들이 등장한 마법학의 역사에서도 보기 드문 천재입니다.{nl} 적어도 170년 정도 후에는 루시드 윈터스푼이나 오윈 딜벤 같은 당대 최고의 마법사들을 넘어설 것입니다.				소녀
QUEST_20170420_005913	拉利沙一定能活到普通人類女性的平均壽命的。{nl} 且那會成為他的天才性無法繼續發展的窮極性障礙。	라리사는 보통 인간 여성의 평균 수명을 살게 될 것입니다.{nl} 그리고 그것이 그녀의 천재성이 더 이상 발전하지 못하도록 하는 궁극적인 장애가 될 것입니다.				소녀
QUEST_20170420_005914	元素使大師 威坎 塞雷斯堤克追求著一段無法成真的愛情。{nl} 他喜歡的女性對結婚毫無關心，只在意永生。	엘레멘털리스트 마스터 위칸 셀레스틱은 이루지 못할 사랑을 꿈꾸고 있습니다.{nl} 그가 좋아하는 여성은 결혼에는 관심이 없고 영생에 관심이 있습니다.				소녀
QUEST_20170420_005915	巫師大師雖然還年輕，卻對老化與死亡有著過多的擔心。{nl} 即使如此我也不能告知他能不能成為安基納斯。{nl} 這點神諭師大師也是一樣的，所以這也有可能是戴姆 奇勒凱討厭阿普羅尼亞的原因。	소서러 마스터는 아직 젊지만, 노화와 죽음을 걱정하여 고민이 많습니다.{nl} 그럼에도 저는 그녀가 암지나스가 될 수 있을지 어떨지를 알려줄 수 없습니다.{nl} 그 점에서는 오라클 마스터도 마찬가지이니 데임 키르케가 아폴로니아를 싫어하는 이유도 일리가 없는 것은 아닙니다.				소녀
QUEST_20170420_005916	魯希德 萬托斯芬雖隱居但無躲藏，但也不會積極地出現在世人面前，就這樣活了數百年。{nl} 雖然尊重她的自由意志，但她就像時間一般，存在我們周圍的同時，也一直流逝。	루시드 윈터스푼은 완전히 은거하여 숨지도 않고, 적극적으로 세상에 나서지도 않은 채, 수 백년의 삶을 이어왔습니다.{nl} 그녀의 자유의지를 존중하지만, 그녀는 마치 시간처럼 우리 주위에 존재하면서 동시에 흘러갈 뿐입니다.				소녀
QUEST_20170420_005917	羅勒塔 寧帕斯是死靈法師大師，同時也是年紀最小的安基納斯，也是個把永遠抓不到的目標放在眼前的女人。	로테타 님버스는 네크로맨서 마스터이자 가장 어린 암지나스이며, 그리고 영원히 따라잡을 수 없는 목표를 눈 앞에 둔 여인입니다.				소녀
QUEST_20170420_005918	鍊金術士大師為了維持溫特史普恩家門的名聲而勞心費力，但其實那個家門的名譽沒那麼容易動搖。{nl} 只是即使如此她還是感到不安，看她那個樣子還滿不忍的。	알케미스트 마스터는 윈터스푼 가문의 명성을 이어가기 위해 노심초사하지만, 그 가문의 명예는 쉽게 흔들리지 않을 것입니다.{nl} 다만 그는 그럼에도 불안해하니 저로서는 안타까운 일입니다.				소녀
QUEST_20170420_005919	我很好奇咒術師大師 梅拉尼 梅拉金日後會如何。{nl} 職業需要，她總是在魔族周圍，受到影響總有無法看到的不透明性存在。	저는 워록마스터 멜라니 멜라킴의 앞날이 궁금합니다.{nl} 직업상 그녀는 항상 마족이 주위에 있기 때문에 그 영향력 탓으로 내다볼 수 없는 불투명성이 존재합니다.				소녀
QUEST_20170420_005920	我期待我的姊妹們能成為世上所有人類的支柱。{nl} 雖然也不是期待落空，但總是對妖術師大師 基奧 路易拉瓦這些人感到抱歉。	제 자매들은 왕국이 세상 모든 인류의 기둥이 되어줄 것을 기대하였습니다.{nl} 그 기대가 무너진 것은 아니지만, 페더풋 마스터인 키올 루아라와 같은 사람들에게는 미안한 마음이 항상 듭니다.				소녀
QUEST_20170420_005921	陰影法師大師伊克爾立斯尤賓克總是努力想要變平凡，其實她一出生就是絕對不可能平凡的命運。{nl} 她的不平凡將會是她終生的負擔也是力量。	섀도우맨서 마스터인 이클립스 유빅은 항상 평범해지려 노력하지만, 실은 절대 그럴 수 없는 운명을 타고난 비범한 여인입니다.{nl} 그녀의 비범함은 평생토록 그녀에게 짐이나 힘이 될 것입니다.				소녀
QUEST_20170420_005922	耶那 哈賓達勒和珍若是生活在同一個時代就好了。	예나 하빈다르와 제인이 한 시대에 살았더라면 좋았을지도 모릅니다.				소녀
QUEST_20170420_005923	魯帕斯 凱赫爾正在找的書中，有一部份是維諾那 安德的收藏。{nl} 但是沒有人知道這個事實。	루파스 케헬이 찾는 책 가운데 일부는 위노나 엔데가 소장하고 있습니다.{nl} 하지만 이 사실을 아는 인간은 없습니다.				소녀
QUEST_20170420_005924	符文師大師 薛利 沛寧頓離開故鄉來到王國南部，已經過了很長一段時間。{nl} 不久後他離開了位置，說不定會因此發生不幸。{nl} 所以在她不在時，就必須有人代替他。	룬캐스터 마스터 쉘리 페닝튼이 고향을 떠나 왕국 남부로 내려온 지, 꽤 오랜 시간이 지났습니다.{nl} 머지 않아 그녀가 자리를 비운 탓에 불길한 일이 일어날지도 모릅니다.{nl} 그 때에 누군가가 그녀의 자리를 대신할 필요가 있습니다.				소녀
QUEST_20170420_005925	夏奧雷伊出身的羅查利亞的夢想本來是治療師。{nl} 他不當治療師，改走牧師大師這條路，是在神樹之日之後。{nl} 這說不定是因為神樹之日而發生的唯一的好事。	샤울레이 출신의 로잘리야의 꿈은 치유사였습니다.{nl} 그녀가 치유사를 벗어나 클레릭 마스터의 길을 걷게 된 일은 신수의 날 이후입니다.{nl} 어쩌면 이것은 신수의 날 때문에 생긴 유일한 좋은 일일지도 모릅니다.				소녀
QUEST_20170420_005926	聖火祭司大師是人類所記得的所有信仰的保存者。{nl} 且他自己可能不知道，人類遺忘的時代的信仰也還在那個教團懷中。	크리비 마스터는 인간이 기억하는 모든 신앙의 보존자입니다.{nl} 또한 그 자신은 모르지만, 인간이 기억하지 못하는 시대의 신앙도 그 교단이 품고 있습니다.				소녀
QUEST_20170420_005927	波洛夫雖然一直都有傳出聖水祭司大師位置，轉任隨軍牧師的想法，但在那之前，在生死交戰的戰場上，他覺得有必要試驗自己是不是能保持自身的信仰心。{nl} 先支援軍隊也是其方法之一。	보러블은 언젠가 프리스트 마스터 자리를 물려주고 채플린 마스터를 이어받으려는 마음을 지니고 있지만, 그 전에 생사를 가르는 전장에서도 신앙심을 유지할 수 있는지 스스로 점검할 필요가 있습니다.{nl} 먼저 군대에 자원하는 것도 한 방법일 테지요.				소녀
QUEST_20170420_005928	瑪嬤瑪利拉寶邪靈祭司大師是在人與他們孤單的命運中擔任中介的角色，也是命運女神的輔助者，人們總是感謝他的勞苦。	마마 마리라보 보코르의 마스터, 사람과 그들의 고단한 운명 사이에 선 중개업자이자, 운명의 여신의 보조자여, 항상 그대의 노고에 감사하고 있답니다.				소녀
QUEST_20170420_005929	泰斯拉是所有人類的大哥，到今天，被他製成雕像，女神們反而感到光榮。 	테슬라 모든 인류의 맏형이여, 이때에 이르러 그에게 조각되는 여신들이 오히려 영광으로 생각한다는 사실을 알려드리고 싶습니다.				소녀
QUEST_20170420_005930	聖殿十字軍大師 瓦倫堤那斯納伊蒙是像現在一樣艱難的時期，支撐王國的四大樑柱之一。{nl} 但既然泰內聖堂的盟約都履行了，我也不想再向他要求什麼。	팔라딘 마스터 발렌티나스 나이몬은 지금과 같이 어려운 왕국을 지탱할 네 기둥 가운데 하나입니다.{nl} 다만 테넷 성당의 맹약이 이행되었으니 저는 더 이상 그에게 무엇을 요구하고 싶지 않습니다.				소녀
QUEST_20170420_005931	聖者大師亞古塔漢斯卡是這個時代的人當中第一個獲得夢的啟示的人，他也因為那個啟示而踏上聖職者這條路。	사두 마스터 아고타 한스카는 이 시대의 사람들 가운데 최초로 꿈의 계시를 얻은 자미여, 그 계시로 성직자의 길로 들어섰습니다.				소녀
QUEST_20170420_005932	麥依史特斯 寇德文特 寬恕者大師是調和物質與精神均衡，從根本將無法測量的信仰心表示為數字的人。{nl} 雖然有時他會太過火，但他絕對是教團需要的人才。	마이스테스 골드문트 파드너 마스터는 물질과 정신의 균형을 맞추고, 근본적으로 측량할 수 없는 신앙심을 숫자로 나타내는 사람입니다.{nl} 그는 자주 도를 넘기는 하지만, 그 역시 교단에 필요한 사람임은 틀림없습니다.				소녀
QUEST_20170420_005933	所有人都知道 吉那 葛林 德魯伊大師個人是王國最有錢的富者。{nl} 我也同意。{nl} 但當其他人看的是她存放在凱都拉商團的鉅款時，我反而只會想到她持有的地下藏著的巴羅昆士的礦山。{nl} 當然不只她，連其他任何人都不知道這個事實…	모든 사람이 지나 그린 드루이드 마스터가 개인으로는 왕국 제일의 부자라는 사실을 알고 있습니다.{nl} 저 역시 동의합니다.{nl} 다만 다른 사람들이 케도라 상단에 예치된 그녀의 거액 예금을 볼 때, 저는 그녀 소유의 땅에 숨어있는 바로콘시의 광산을 생각합니다.{nl} 물론 그녀뿐 아니라 누구도 그 사실을 모르긴 합니다만….				소녀
QUEST_20170420_005934	神諭師大師 阿普羅尼亞 巴勒寶拉是即使女神不在，也從沒放開過與女神的連繫的聖職者。	오라클 마스터 아폴로니야 바르보라는 여신들이 부재한 시대에 여신과의 끈을 놓지 않는 성직자입니다.				소녀
QUEST_20170420_005935	發現看不見的法則、連女神都能拘束的宇宙原理的探索者卡巴拉們的首長，里布加 希帕提斯雖然現在是無官從軍，但他總有一天能重回王國高官職位的。	보이지 않는 법칙의 발견자이며, 여신들까지 구속받는 우주 원리의 탐구자들인 카발리스트들의 수장인 리브가 히파티아는 비록 지금은 백의종군하고 있지만, 언젠가는 다시 왕국의 고관으로 돌아가는 편이 좋다고 생각합니다.				소녀
QUEST_20170420_005936	若牧師大師 羅查利亞與瘟疫醫生大師 畢里 奧雷魯斯的年紀差異再大一點，那次代大師繼承者定會是羅查利亞。{nl}  一般治療或者仰賴神聖立的治療，兩者才能兼具的人少之有少，這也許能看作一種不幸。	클러릭 마스터 로잘리야가 플레이그닥터 마스터 필립 아우뢸루스와 나이차가 더 많이 났다면, 차기 마스터 계승자는 로잘리야였을 것입니다.{nl}  일반적 치유술과 신성력에 의지한 치료, 두 가지에 동시에 재능을 지닌 사람은 많지 않다는 점에서 어쩌면 이것은 불운이라고 할 수 있습니다.				소녀
QUEST_20170420_005937	審判者是所有聖職者中，最常輔佐女神的人。{nl} 他們的首長托瑪斯 伊科諾施塔席斯邁入晚年，遇上了他的任何繼承人都沒遇過，沒有女神幫助的情況下，他只得承擔下分辨女神真正意思的責任。	인퀴지터는 모든 성직자 가운데 가장 여신을 많이 보좌하는 사람입니다.{nl} 그들의 수장인 토마스 이코노스타시스는 말년에 이르러 그의 어떤 전임자도 겪지 못했던 사태를 맞아 도와줄 여신이 없는 상태에서 여신의 진정한 뜻이 무엇인지 분별해야 하는 막중한 책임을 지고 있습니다.				소녀
QUEST_20170420_005938	雖然任何聖職者都能成功，卻果敢地選擇隨軍牧師這條路，凱斯爾羅巴斯成為91年來首次平民登上隨軍牧師大師的例子。{nl} 王國的隨軍牧師並不是為了為死去士兵祈禱而存在的，因此沒有家門後援，能爬到這個位置，大概一個世紀才會有一個。	어떤 성직자로서도 성공할 수 있었으나 과감히 종군사제의 길을 택한 케슬로바스는 91년 만에 다시 평민이 채플린 마스터의 지위에 오른 사례이기도 합니다.{nl} 왕국의 채플린이 죽어가는 병사를 위해 기도나 해주는 존재가 아니기 때문에 가문의 후원없이 이 자리에 오르는 일은 왕국 역사에 한 세기 한 번 정도 일어나는 사건입니다.				소녀
QUEST_20170420_005939	不侍奉女神，而是理解人類心性，振揚士氣以接近神性的特異聖職者，便是道士。{nl} 勾洪將選擇此信仰修行的歷代道士所有記錄整理熟讀，領會一切以後成為道士大師。	여신을 섬기는 일이 아니라 인간의 심성을 이해하고 고양시킴으로 신성에 접근하는 특이한 성직자가 도사입니다.{nl} 갈홍은 이러한 신앙수행을 택한 역대의 도사들에 대한 모든 기록을 정리하여 알고 있으며, 그 모든 길을 터득한 도사 마스터입니다.				소녀
QUEST_20170420_005940	對巫女大師兼世上神靈的溝通者 希托彌扣來說，他缺少的是勤勉精神。{nl} 對此我覺得很可惜。	무녀들의 마스터이자 세상의 신령들의 교통자인 히토미코에게 부족한 것은 근면성입니다.{nl} 저는 그것을 아쉽게 생각합니다.				소녀
QUEST_20170420_005941	弓箭手大師艾德蒙達斯 提羅現下最關心的就是星之塔建造的方式了。{nl} 不僅是因為他認為這能加強柯拉佩達的防禦設施，也表露了他對利迪亞夏班的憧憬。	아처마스터인 에드뮨다스 틸러의 현재 최대 관심사는 별의 탑이 건설된 방식입니다.{nl} 이는 그가 그것이 클라페다의 방어시설을 보강하기 위해 도움이 된다고 생각하기도 하지만, 리디아 샤펜에 대한 동경심의 발로이기도 합니다.				소녀
QUEST_20170420_005942	弩箭手大師 里恩 托伊洛跟弓箭手大師一樣，很關心柯拉佩達的防禦設施補強。{nl} 雖然有些人認為他收集了太多的石頭，但那些並不全是為了射擊才收集的。	쿼렐슈터 마스터 리엄 토일러는 아처마스터와 함께 클라페다 방어시설 보강에 관심이 많습니다.{nl} 어떤 사람들은 그가 돌을 너무 많이 모아들인다고 생각하지만, 그걸 다 쏘려고 모으는 것은 아닙니다.				소녀
QUEST_20170420_005943	艾保尼風的生命無關遊俠大師 尼墨肯，而是從屬於你的選擇。她若是知道了一定會很難過。	에보니폰의 생명이 레인저 마스터 니모켄이 아니라 당신이 택한 운명에 종속되었다는 사실을 그녀가 알면 슬퍼할 것 같습니다.				소녀
QUEST_20170420_005944	因為我知書達禮，就算我對於獵人大師 皮歐那 伊艾巴知道些什麼，我也不能告訴你。{nl} 但不論實力，還是過去事跡，她確實是值得尊重的大師。	저는 예의를 알기 때문에 헌터 마스터 피오나 이에바에 관해서는 무엇을 알고 있건, 말씀드릴 수 없습니다.{nl} 그러나 그녀는 실력이나 과거의 행적으로나 존경받을 가치가 있는 마스터입니다.				소녀
QUEST_20170420_005945	希望工兵大師總有一天能知道，他的父親到最後一刻都還惦記著兒子。	그의 아버지가 최후의 순간에 아들을 염려했다는 사실을 새퍼 마스터가 언젠가는 알게 되길 바랍니다.				소녀
QUEST_20170420_005946	即使因為投身軍旅不久，階級還不高，但在不背離自己的前提下，她一定能同時身兼斥候大師與王國軍將軍職位的。	비록 군문에 투신한 지 얼마 되지 않았기에 그녀의 계급은 아직 낮지만, 그녀가 스스로 떠나지 않는 한 그녀는 스카우트 마스터와 왕국군 장성의 지위를 겸하게 될 것입니다.				소녀
QUEST_20170420_005947	沃 帕與他的妹妹共同致力於將巫蠱師的傳統發揚光大。{nl} 也因為在王國，少數民族獲得王室認證登上大師職位非常稀奇，所以他必須更加努力。	워 팻이 그녀의 동생과 더불어 무고사의 전통을 빛내길 바랍니다.{nl} 왕국에 존재하는 소수민족이 왕실의 인정을 받아 마스터의 지위에 오르는 일은 드물기 때문에 그녀의 더 큰 활약이 필요합니다.				소녀
QUEST_20170420_005948	流氓大師蓋瑪雖然幾乎沒有效力公益或做有益他人的行動，但他覺不是心性偏差的人。	로그 마스터 게마는 공익이나 이타적 행동을 하는 일은 거의 없지만 절대로 심성이 나쁜 사람은 아닙니다.				소녀
QUEST_20170420_005949	畢斯巴達斯 布雷克非常在乎初代造箭者大師的成就。{nl} 雖說布雷克家門向來自負心重，而他尤甚。但他即使沒有祖先與家門的光環，也已經是一個出色的大師了。	비스발다스 블랙은 초대 플레처 마스터의 업적에 너무 연연하고 있습니다.{nl} 블랙 가문이라는 자긍심이 더욱 그런 경향을 짙게 하고 있지만, 그는 선조와 가문의 후광이 없어도 이미 훌륭한 마스터입니다.				소녀
QUEST_20170420_005950	在歷史上，馴鷹者大師有數次是獵人大師去兼職的。{nl} 皮歐那 伊艾巴在天才少女鷹飼育師出現後，就欣然地查了查先例，同意將兩個職種分離了。{nl} 當個參考，貞葛拉斯 梅塔伊的故鄉是王國首都。	역사적으로 응사 마스터는 수 차례 헌터 마스터가 겸직하곤 하는 일이 있었습니다.{nl} 피오나 이에바는 탁월한 소년 매사육사가 출현하자 기꺼이 선례를 조사해 두 직종의 마스터를 분리하는데 동의하였습니다.{nl} 참고로 젠클라스 메타이는 왕국 수도가 고향입니다.				소녀
QUEST_20170420_005951	艾達 薩伊克 巴拉賈斯是所有大師裡爵位最高的大師。{nl} 當然在軍人中階級是比烏斯卡或諾歐 帕雷塞烏斯低。{nl} 但單看爵位，他還比歐勒夏領主高。	에다 세이커 바라자스는 모든 마스터 가운데 가장 높은 작위를 보유한 마스터입니다.{nl} 물론 군인의 계급으로는 우스카나 노어 파레세우스에 비해 하급자이지만 말입니다.{nl} 작위로만 따지면 오르샤 영주보다 그녀가 위입니다.				소녀
QUEST_20170420_005952	火槍手大師 阿爾洛德 瑪傑林通過了無數試驗才成為大師。{nl} 怪物獵人、賞金獵人、軍人、傭兵、保鑣等，雖然做過很多職業，但共通點是都使用槍。	머스킷티어 마스터 알로덴 마자린은 무수한 직업을 거쳐 현재의 마스터가 되었습니다.{nl} 몬스터 사냥꾼, 현상금 사냥꾼, 군인, 용병, 경호원 등 많은 직업을 지녔었지만, 공통점은 언제나 총을 사용했다는 점입니다.				소녀
